,funny,useful,review_id,text,business_id,ID_bus,stars,date,user_id,cool,polarity,subjectivity,restaurants_sentiscore,restaurants_total_business_score
6643,13,20,gpR0LKDuQHq2DWlHSU54dg,italian unofficial official second major college studied rome three months florence three months went back several times after experience magic over again while there learned many things about italian culture solidified language skills imagine thing that found most exciting educational italians relationship with food regardless region found italians united shared beliefs about food preparation eating many which were foreign prior going example italians took given that salad comes after meal before fresh fruit dessert snack breakfast alfredo sauce mozzarella sticks italian alcohol exists enhance flavors food drunk pepperoni thin slices cured pork peppers know vegetables this blew mind most idea course these guidelines come across americans strict rules love culinary freedom that makes sense have many different types food types people types lifestyles plus italian food changed hands immigrants came here however even going follow every guideline took from experiences italy sense genuine appreciation simple fresh flavors desire slow down truly enjoy what eating greater awareness that different dietary components come together create balanced diet better internal functioning since back found italian restaurants that really embody these principles refusing dumb down speed their food american masses well pizza metro part that elite category thrilled have found here phoenix just short drive from house maurizio makes goal serve customers fresh simple carefully prepared food that allows flavors individual ingredients shine appreciate that much checked place first time last friday night made reservation advance which great idea because only wait minutes seated once arrived were promptly greeted maurizio quickly drink order taken server little nervous about speaking italian since pretty rusty figured should since havent many chances california where grew here phoenix when maurizio returned with bread basket take order worked courage ordered italian even though super busy maurizio asked questions back italian where study continued converse with italian throughout rest meal much speak again especially when food delicious really took back study abroad time decided start with grilled calamari then have penne amatriciana medium pizza frescolina bread basket phenomenal with lightly oiled pieces italian flatbread with cold mixture eggplant olives onions almost like italian ratatouille when calamari arrived discovered that fried grilled both appetizer options grilled more prominent italy decided anything anyway were glad because reminded seafood fritti misti italy just lightly battered with hint seasoning came with tomato sauce delicious with just squeeze lemon entrees were even more delicious pasta could have been more dente probably because most americans dont that harm done just order that next time sauce incredible truly authentic perfectly combined fresh tomatoes tender pieces pancetta onion garlic olive without being thick sweet pizza also with thin flour brushed crust small amounts milky mozzarella fresh tomatoes arugula salty prosciutto just like italian pies flavors were balanced single overwhelming know medium huge even with huge appetite ended taking slices home only spent amazing deeply satisfying meal that brought back memorable time italy absolutely cant wait back more things practice italian again,VRC7J-ahI4em9ddhihxq5w,VRC7J-ahI4em9ddhihxq5w,5,39690.9981712963,gru76BjkRY6UQVcw_yAxiQ,20,0.19634698116006521,0.45582257825248473,0.0,0.00641025641025641
6666,4,33,V-AgUHJAHT5UViVgYi7FIw,yuck just moved area were looking restaurants this place mistake hummus very strange texture despite being called cilantro hummus there flavor husband blue cheese burger greasy under cooked just tasted chicken mango pizza with avacado avacado mushy tried send pizza back were treated with respect shocking manner paid left never again,DN0b4Un8--Uf6SEWLeh0UA,DN0b4Un8--Uf6SEWLeh0UA,1,41769.076053240744,TU0LXPVbHIoSzn9ZTVU2gA,2,-0.2775,0.3741666666666667,-0.003205128205128205,0.009615384615384616
6691,0,1,OpSeScV0vF4qGTdfuMnupw,experience last times came here both were tempe location first bowl that tasted really weird they gave bowl charge that turned okay second time asked about pieces chocolate bowl that noticed last time there chocolate pieces werent there before probs didnt notice them asked they were vegan theres dairy free vegan chocolate chocolate vegan just have check been told bowl been ordering this whole time vegan except honey then woman counter said chocolate pieces could have milk them sure double checked actually does told until then that sure just honey bowl that vegan didnt want chance asked could just replace chocolate shavings with another topping they wouldnt replace chocolate shavings with another topping without charging extra already order bowl sans honey swapped ingredients that either sure something small chocolate shaving last straw because paid extra other things that were bigger deal like paying full price cheese pizza with cheese been pretty tired feeling gipped because have remove toppings ingredients make dish vegan then still full price sometimes extra this case they charged extra replace ingredient sometimes they want extra just take ingredient bowls made fresh like theres premade they would have swap ingredients nice thing dont have this anymore because many already marked vegan options vegan restaurants popping ended ordering anything leaving even though been coming here over years going have genuine fresche after these experiences just dont want come here anymore,qOd7QUh-sIB7zN7RbP1-qw,qOd7QUh-sIB7zN7RbP1-qw,1,43251.68162037037,svyVKwAJkkbhJjGhnLoBWw,0,0.14274193548387099,0.4411290322580645,0.0,0.0
6784,0,0,G6z37-c6RKZBV5OMHAjY_w,have been nellos many years however after experience sunday will never have your pizza again several months ordered usual combo pizza with everything surprise crust very different light color tasted like nothing toppings were good chalked just dough months later again ordered take same crappy crust uncooked usual crunch toppings were fewer sunday after running marathon taste buds craved your pizza this time absolute worst stating past pizzas been asked crispy crust surprise this worst pizza have years crust under cooked dough ball mention minimal toppings called complain asked they have owners dough recipe however called manager said both questions offer give another pizza nellos longer list restaurants three strikes your,j-SSlq3__BQr3H7lAyVvkw,j-SSlq3__BQr3H7lAyVvkw,1,41298.008206018516,sDkN3zVG_0kEMzKfkHuvKw,0,-0.07666666666666667,0.4703333333333333,0.0,0.0
6848,0,1,4GTBLwSGWSdbvHobst6VcA,cesar salad homemade croutons start inch cheese pizza good thank goodness yelp those travel have found many good restaurants this this place exception nice little patio great place come before movie theatre right across parking great service marianne,IkLAUX7lZIWqE9_YC66SRw,IkLAUX7lZIWqE9_YC66SRw,5,41958.98255787037,ZdTDbZu7PD2lGj1LA1yYoQ,1,0.5247767857142857,0.6544642857142857,0.003205128205128205,0.01282051282051282
6852,0,0,4GUZIbH2IqoDtTJGUi_9gw,favorite restaurants phoenix awesome avocado prosciutto pizza baked wings fried sangria,7cK9uEV09iPmsTqOqmY3kQ,7cK9uEV09iPmsTqOqmY3kQ,5,40784.948541666665,7iljWwtMZPH6gjDY9DKa6Q,0,0.75,1.0,0.003205128205128205,0.025641025641025637
6883,0,0,eZkXlwDEvPrSx5JHsE_Uwg,from chicago enjoy thin crust square chicago style pizza then youre going love chizonas chicago arizona travel from palm springs california area almost monthly medical care mayo clinic both phoenix clinic specialty building mayo medical building scottsdale shea blvd look enjoyable review days suites noth pima road last stay month picked hotel local restaurant list noticed chizonas pizza they deliver room grew chicago relocated california seems that best chicago pizza dogs ribs most north suburban fast food relocated arizona with exception chicago style restaurants there little offer west phoenix tucson imagine surprise find rare thin crust pizza into squares from chizonas wife offered pasta split salad order garlic cheese bread this best pizza west chicago sure love louis magnetic ginos east rosatis when they were still owned chicago family california rosatis chain much desired love luck crust pizza years longer loves give some idea comparison there similar thin crust pizza milwaukee southeast devon called father sons remember this enjoyed then will love chizonas rosa dempster street skokie also great thin thick crust pizza going back went college urbana might remember fraternity sicilia pizza poppa dels these were some best days pizza lovers give chizonas sure wont disappointed bonus look review another chicago restraint youll love portillos vienna dogs poppys buns charburgers italian beef sausage more true chicago scottsdale shea blvd,6zincCvQTb9BsuK-GHZ4cw,6zincCvQTb9BsuK-GHZ4cw,5,42427.133518518516,IvFrSXDMUanKdW3Pum1EmQ,1,0.22607142857142853,0.49055555555555547,0.0,0.0
7008,0,1,iD6mMaMaPYUnZT2jCO9p-A,best restaurants area staff spectacular polite different varieties pizza delicious pimento cheese would highly recommend anyone great date spot happy hour girls night really nice occasion dress casual there diverse crowd,7cK9uEV09iPmsTqOqmY3kQ,7cK9uEV09iPmsTqOqmY3kQ,5,41507.66200231481,FgeE5Y4ztHKiwd3h8OyTKQ,0,0.4955555555555555,0.772962962962963,0.003205128205128205,0.025641025641025637
7017,0,0,8VBRYsZWAz4rSuEUozbhww,after moved phoenix searched restaurants that birthday deals spinatos sent birthday coupon figured weve give husband fell love with pizza environment that wonderful vodka cream sauce loved that owner walked around visiting with customers very homely environment they even gave pregnant friend baby onesie love going back pizza meatballs course buying vodka cream sauce take home highly recommend,RztX0zV7ObHZD08SDUhI0Q,RztX0zV7ObHZD08SDUhI0Q,5,42203.9865625,oURT-IKSl__k9A_w35PWAQ,0,0.42416666666666675,0.5425,0.0,0.00641025641025641
7165,0,0,fSL4zqM_TaCXGAh3HrxbWA,love pizza much that time crazy life opened owned pizza restaurants course like preferred style pizza york haven chicago sicilianwe could forever spinatos pizza perfect taste almost good ledos university maryland campus first crust thin perfect there other crust optionsbut ordered thin sauces sweet cheese just right amount greasiness toppings were plentiful this crispy crust brick oven pizzathis great loaded with toppings pizza have found favorite pizza place phoenix sorry oregenos will back,RztX0zV7ObHZD08SDUhI0Q,RztX0zV7ObHZD08SDUhI0Q,5,42141.95923611111,UFeT5Jvd2UL2LSiKgj8Gmg,0,0.22254464285714287,0.6652529761904762,0.003205128205128205,0.00641025641025641
7230,1,1,yT8ohf_a8Qy4zlR9ZyWwqQ,tried this place time during weekday lunch pretty busy felt price little high pizza salad options were good other similar restaurants community pizza itself seemed average fired pieology across street from blaze,ptWNY_h088kmKhsL-gaOEg,ptWNY_h088kmKhsL-gaOEg,3,43280.011979166666,M_az-KZ6M8PjoHYgrZ2SeA,1,0.09343749999999999,0.514375,0.003205128205128205,0.003205128205128205
7245,0,7,arrb75WE-fw6Z6fALV0iaQ,wife here because were mood fresh hamburgers when arrived sunday about place almost completely empty this scared little there local game starting that time cardinals seahawks seems everyone game told place normally wait inside they have large flat screen over opposite corner showing sports with closed captioning thank wife each ordered burgers side cheese burger came with fries hamburger buns very unique they like swirled garlic bread however there really noticeable garlic taste which good thing concerned each time brought burger mouth aroma garlic from bread quite nice cheese elbow macaroni sitting soup cheese blend that more like grandma used make then might expect like burgers exceptional fries shoestring style very thin very crunchy everything tastes fresh frozen home made burgers uniform shape thickness which tells they made hand hallelujah service outstanding staff extremely attentive noticed they have vernors pound cake desert menu vernors drink made detroit where born raised asked restaurant detroit inspired told actually brooklyn york inspired they really like vernors ginger york they also have root beer float menu asked staff they offer vernors float instead vernors float known folks detroit boston cooler different than root beer float except substitute vernors root beer they never heard before shocking since outside detroit ever heard they were more than happy make delicious wife thought ordered tasted little didnt anything staff have doubt they would have made right brought their attention also ordered vernors pound cake desert thought rich liking wasnt means appears three restaurants beside each other owned same entity there charr then pizza place isas pizza then fine dining restaurant called aiellos east coast italian there were plenty items menu wanted such baby back ribs grilled chicken sandwich pizza served next door looked good aiellos also looks like nice place well have four reasons back each other restaurants other menu items charr worse comes worst would definitely back charr have real fresh handmade burgers again going open burger joint this similar would theres only many fast food burgers ingest before desperately craving something that isnt factory made doesnt require loan complete total dinner desert after quite reasonable fair considering quality quantity food excellent service received,1WBkAuQg81kokZIPMpn9Zg,1WBkAuQg81kokZIPMpn9Zg,5,41995.165555555555,,2,0.11856182795698926,0.526036866359447,0.0,0.0
7387,0,1,ffJkyT7GLNbvJvblq1cEXw,family tried this giant rustic pizza last weekend overall enjoyed pizza salads will definitely return boys year twins sometimes picky eaters with this pizza they absolutely loved didnt find oily bland soggy crust pretty darn good like putting crushed pepper mine thats probably didnt notice sauce needed anything salads there were very generous portions meat italian kitchen california dreamin excellent employees were very friendly personable which good quality have food service business like many restaurants sure small kinks will worked over time,Sh-XzCG2pZ59g85kjROciw,Sh-XzCG2pZ59g85kjROciw,4,41429.01050925926,sbhMGFeph4UZS4_OXJCmAQ,1,0.2789351851851852,0.5521604938271606,0.003205128205128205,0.003205128205128205
7399,0,1,HfHBnOQrshPSf2ambb7gJA,mellow mushroom those restaurants that expect find area seriously there pictures mushrooms napkins menu decor yeah talking about kind mushroom ones that hide from your parents lets talk food party three ordered pizza side mellowterranean other magical mystery tour mellowterranean earns while magical mystery gets solid those awesome places located mill place would take college buddies,HjXI6lKGPVNQ8dYJPtaOCg,HjXI6lKGPVNQ8dYJPtaOCg,4,40821.264502314814,2nE0zU6y_F7gkwHi3yL6cQ,0,0.3059523809523809,0.7202380952380951,0.0,-0.003205128205128205
7425,2,4,wraJOhgirXD5C4y3zwcwvA,after pickup orders from here this become spot pizza phoenix area establishment part larger group restaurants based santa monica spearheaded lynn well known gentlemen made houstons chain success that they establishment clearly like business thats necessarily thing particularly given that value buck that gets here quite impressive solid size pizza feed people under with some premium ingredients like avocados basil thats quite impressive deserves back just pulling that style pizza itself view very california crust much thicker sturdier than that neapolitan pizza ingredients flavors much lighter than most american style pizzas many many healthy options also liked crunch edges with some cheese baked having tried numerous pizzas here from avocado mushroom onion even meat pizza enjoyed them they really very good pizzas loaded with toppings very generously shop itself cool overpriced degree cant even describe mean really really overpriced some small juice bottles here sell that would sell half that grocery stores honey comb whopping mexican chocolates small piece sauces somewhere around cool concept just business profitable shop clearly making some serious margins suggest sticking pizza here,7cK9uEV09iPmsTqOqmY3kQ,7cK9uEV09iPmsTqOqmY3kQ,4,43077.255162037036,XNPwLVwHPyrOaEQA_sI1wg,4,0.2207552083333333,0.4469010416666666,0.0,0.025641025641025637
7456,0,0,7SUZZy0f4oqeh6PcbCF43Q,mexican making pizza this place very weird atmosphere staff awkward weird true york pizza this chain restaurants that should something this place sucks save your money rays pizza pizza even barrows pizza,Tp07u-0AOFRfQhtNpAXaQA,Tp07u-0AOFRfQhtNpAXaQA,1,42152.91119212963,8jW3qoXUmRs1myNDkSW00w,0,-0.2833333333333333,0.6583333333333333,0.0,0.00641025641025641
7528,0,2,5lkq-Hy-X6kNYIVfxYKofA,year patron happy valley mellow mushroom never missed opportunity rave about place when this location opened just minutes from house thought sure gift from however after visits will never returning this restaurant will happily make longer trek happy valley where know will leave satisfied first visit hours long choosing only take them over minutes drinks water coke then hour meals husbands meal wrong they offered make pizza really ordered obliged known would take them another hour make freakin thing would have said thanks this only weeks after they opened thought that maybe because they were still getting their bearings didnt realize busy they would even though place empty gave them another shot next time take pizza from them cold suppose cant blame them that this visit reason writing this review last straw occurred last week wednesday october family town sister year niece brought month dinner well requested outside because just plain gorgeous arrived before upon going outside immediately with smell cigarettes tried pick table that seemed further away from smell thinking just some passers outside restaurant unknowingly chosen table closer table where were smoking under impression that smoking longer allowed restaurantsi didnt think this news husband politely asked server what their policy smoking said after they allowed which still think bull since well before asked move they stepped just outside area lovely draft made stench even worse couldnt complain since they werent technically restaurant anymore food arrived good conversation kept getting interrupted some loud people turned actually servers kept going over smoking table socializing with were also servers discovered this because when left table shortly reoccupied female servers their breaks promptly well only this illegal with babies nearby extremely inconsiderate when left were very disappointed embarrassed because raved much about this place guest such terrible experience husband went asked manager unfortunately didnt name sneaking suspicion that actually manager server pretending manager asked this person what their policy smoking said they allowed ends middle what heck kind smoking policy that were told something different before will never going back this location suggest that unless your favorite pizza condiment second hand smoke dont here either,v2tjswIV3e0c8o7_7MwYmg,v2tjswIV3e0c8o7_7MwYmg,1,41197.66484953704,F17NNrL0dP_-187QW_PskQ,0,0.04971428571428572,0.5000873015873017,0.0,-0.003205128205128205
7574,0,1,9wvHHCvbFA3UELDnM-SW3g,been mission pizza place weekly love pizza like thin hand crust primarily open variety toppings exception pineapple have tried least restaurants recently hands down this place best pizza ever shock lots couple pool tables might bartender waitress least other people took care other server still treated outstanding service different types peanuts this frills dont expect fancy expect exceptional pizza will back,AdB7a8eo7uK_Fq-aX6_l8g,AdB7a8eo7uK_Fq-aX6_l8g,5,42260.09774305556,psXraBCZWL5WrA_feKOctw,0,0.09007936507936508,0.48670634920634914,0.0,0.0
7604,0,3,4t9-bZy0uF4HdwHO_G0FNg,isabellas kitchen gets stars atmosphere just love this place based first lunch there building sits right grayhawk golf course with expansive views mountains night they lights city there plenty places hang your even youre dining indoor tables there large outdoor couches rocking chairs fire like seating outdoor tables lights strung from building isabellas surely going very popular hangout well dining spot throughout year server christopher attentive very sincere about making sure that everything liking very knowledgeable place having just opened only days when didnt have answers questions like your patio friendly went manager unfortunately friendly since abuts golf course they many available options their limited opening menu more than than some restaurants have their regular menu regular menu starts tomorrow october worries honestly having seen full menu probably would have picked options anyway cheese dreamy noodles almost consistency gnocchi very tasty with accompanying small cubed creamy cheese crispy bread crumbs this best cheese dishes have long time perfect size share calories could have this main course been full happy hubby meatball sandwich which nice size lunch eggplant parmesan sandwich which came foccacia bread layered eggplant tasty could have been warmer little more sauce cheese both sandwiches came with choice house salad potatoes both opted potatoes they were just amazingly delicious like deep fried potato chip very crispy outside with real potato texture inside delicious will definitely back check some other items that other diners enjoying like bruschetta pizza pasta this place with personality mangia mangia buon appetito,dSnQTUJC0tCHadU1AGzvrw,dSnQTUJC0tCHadU1AGzvrw,4,41197.12125,qxmdrMmjTzgQhyHXKuyy3Q,1,0.33542233560090695,0.5322722251293681,0.0,0.0
7636,0,0,JT8EwAEY4G-0HXdZtZbL9g,this place miss terribly ever since moved away least three times during week long vacays back scottsdale always order exact same thing pablo picasso salad hold cilantro pizzookie chocolate chip course tried pizza sandwiches apps these only things that have coming back dressing picasso salad tastes like delicious mexican party your mouth salad itself many wonderful ingredients including very delicious slightly spicy fajita chicken there four different kinds cheeses here tomatoes chips love this salad however love pretty much nothing more this universe sorry than amazingness that pizzookie often dream about wish could replicate kitchen even other restaurants fail making this dish perfect looking boulders oreganos excels makes want this every never finish whole when feel sick most satisfying usually share pretty greedy territorial though watch service here always very friendly nice many male servers very attractive thats nice bonus prices definitely cheaper side they have some options making your salad junior size bucks less still food bottom line have pizzookie hate later weight made gain from becoming addicted during those orgasmic moments when warm melty cookie your mouth youll thanking,_ZwDLtBopUHb6F2mIPFUJg,_ZwDLtBopUHb6F2mIPFUJg,5,40518.845405092594,yEVQsp9N1nFxFpfXsdPwYA,0,0.154883658008658,0.5850108225108226,-0.003205128205128205,0.006410256410256411
7701,6,6,pezf4ZlBvvqOOQJ12Gkg7Q,find jekyll hyde type place will give review with equal parts duality though going against overwhelming positive grain give stars reasons below food hyde says this place seems different types restaurants theres breakfast brunch servings then theres alternate menu which consists salads their eponymous pizzas what worth been here many times more than cared girlfriend used live within walking distance convenient counter with convincing argument against going many visits breakfast just felt underwhelmed food dishes crepes always leave feeling unsatisfied find they lack punch flavor department what worth theyre going french flare cuisine still always seems under deliver jekyll says contrary breakfast foods quite good salads pizzas really good freshly made what would expect from artisanal pizza place additionally they have solid beer wine list brick mortar hyde says this place specifically during breakfast hours disaster would make retail operations manager cringe lack flow before them line station order food line another station order coffee theres table service have order your food while scout random table opening while also keeping watchful your food make sure claim before goes cold this entire place also operates what most people think really cute market full curios that other people call junk hyde believes that this market only adds utter chaos lack flow restaurant would different side smack middle everything yields chaos jekyll says avoid breakfast dinner where have great salads pizzas actually seated table hostess served waiter what revelation dinner area actually different room avoid really cute market getting there hyde says parking rather lack there huge negative there minimal parking premises minimal parking across street with most neighboring businesses posting signs threatening jekyll says lets call this place what nice neighborhood restaurant that prove convenient live nearby walk avoiding hassle frustration that awaits when have drive there summary really four stars pizza breakfast foods they dinged extra star headache that parking many phoenicians love this place think better elsewhere authors note girlfriend moved from this neighborhood argument favor visit based proximity moot hyde cracked menacing smile,7cK9uEV09iPmsTqOqmY3kQ,7cK9uEV09iPmsTqOqmY3kQ,2,41065.11430555556,ZvDtmZzFtBop5pVJ3fbPIA,1,0.19627659574468087,0.5400924134966689,0.0,0.025641025641025637
