,funny,useful,review_id,text,business_id,ID_bus,stars,date,user_id,cool,polarity,subjectivity,restaurants_sentiscore,restaurants_total_business_score
133,0,0,y78b0o6R1ZB0lLEUKauLvg,generally chain restaurants chain restaurants good cheesy both food sense humor food portions huge taste pretty good price points good service friendly this place always packed prepared wait they have pizza please both fans thin crust thick although thick crust pizza prepared wait always wedding soup which delicious with meatballs small bits pasta chicken broth salty which makes super happy youre brave pizza cookie they have different kinds pizza dough topped with vanilla cream,dUffgo9Lh_Vk9TLuFR5ywg,dUffgo9Lh_Vk9TLuFR5ywg,4,40552.871354166666,S5dGv1vID1hoBZm2A9fK5g,0,0.20879629629629626,0.7287037037037035,0.0,0.02564102564102564
142,0,0,HVF_mdpJWtSrtSnz5zw5sQ,this easily best pizza restaurants have ever been staff very friendly knew names majority people walking through door truly best have ever just started working next this place will visiting often,pCWg4B0R5gauQR4SJ9VDmw,pCWg4B0R5gauQR4SJ9VDmw,5,43326.78,zRWBhvkKCzGw7BXAhwueIA,0,0.621875,0.3125,0.003205128205128205,0.0
179,0,0,iMG368SWzyouf66o-gsfRw,this best pizza ever weve tried many pizza restaurants this place without doubt star owner compassionate about establishment that attitude shows service quality food have pizza italy youll same quality here this restaurant real deal,cs1qJvnWUg_f8g020z_3PQ,cs1qJvnWUg_f8g020z_3PQ,5,41572.07420138889,vkWwNxS2G8uIJNkgK3ocHQ,0,0.425,0.30625,0.0,0.035256410256410256
213,0,0,klxhvAg_oYUhhWVi-uUbVg,four severs smiled greeted with hello welcome table server would with karina among best ever anywhere travel work four five star restaurants when have this kind experience casual eatery deal garlic cilantro parmesean wings were literally life altering main course pizza numero sensational when were ready leave asked manager told about great experience gave salted caramel pizza cookie still orbit cant wait back,dUffgo9Lh_Vk9TLuFR5ywg,dUffgo9Lh_Vk9TLuFR5ywg,5,42657.27712962963,,0,0.4333333333333333,0.5416666666666667,0.0,0.02564102564102564
224,1,1,KSfTYooYt--pRbqKIkEtgg,love everything about this place except long drive from house they opened cenpho location would heaven however always well worth drive where start normally stick things menu most restaurants this place many good ones bounce around first salads currently obsessed with spicy peanut chicken salad also love green saladsimple light tasty sandwiches spicy boylove bowls kung favorite also like spicy peanut bowl they actually both very similar though either great pizza westerndelish probably best part greenthe soynami several amazing better than other soft serve option throwing down gullet before began vegan sometimes they even have wedding cake soynami ever this menu could forget appshummus wings favorite this place very reasonably priced meals soynami about bucks staff always super nice friendly service always fast atmosphere pretty funky cool although might this from outside just inside youll fine weve also been there july thanksgiving both were awesome everyone thinks vegans badly thanksgiving with dead bird couldnt imagine anyone loving greens thanksgiving meals there enjoy,5FIOXmUE3qMviX9GafGH-Q,5FIOXmUE3qMviX9GafGH-Q,5,40458.81728009259,Gfw63_PbeMMcu8N0PqgMHg,1,0.25780626780626775,0.578988603988604,0.0,0.003205128205128205
236,0,2,zUt2Cdn4jY13MRjAjOl7iA,after restaurants with prepared owner came went nice folks centurion making results good place tried safe note will more adventurous back italian burger came with nice simple salad with strawberry balsamic dressing burger stacked with proscietta well made bland have more impressed with originality salad then plain choice burger good friend margharite pizza tasty maybe more spinach would have even better vegetarian lastly another friend ordered mussels dish loved wine mine imported cava somewhat pricey champagne glass flute burger patio which come along from previous restaurant versions this location inside looked nice think twice about blasting inappropriate rock music this tiny bistro like room putting glad quiet street there been tables open outside would have stayed service great paced attentive feel like this family project which will come back other dishes wines unique feature that wines imports kinda neat roosevelt grow,pKiSzUlBBRNEdTML24piXA,pKiSzUlBBRNEdTML24piXA,3,40461.82498842593,NoAmYkQqj_wNGr1-MRBNog,0,0.31007936507936507,0.5529761904761905,0.0,-0.003205128205128205
257,0,1,Xhq2lPpn1kSKJqUr1Sy2GA,jersey girl used sauce gravy great pizza meatballs served people with italian accents because they from italy this best italian restaurants have enjoyed food real italian focus pasta meat tons mozz chicken with peppers lovely chicken falling bone husband bolognese real thing with carrots base father best sausage cauliflower cavatelli homemade noodles want take this restaurant back home show mozz crowd what italian food they source from local farmers five stars plus,cs1qJvnWUg_f8g020z_3PQ,cs1qJvnWUg_f8g020z_3PQ,5,41191.11798611111,xixaujsCWefs3WU8m9A5uQ,1,0.1333333333333333,0.4,0.00641025641025641,0.035256410256410256
259,0,1,sJvtajSToWF6ZXTZlXpw0g,went wednesday night with family experience ordered food consisted baked pesto pasta which good spectacular spectacular little cousins wanted ridiculous dollar holy mother pizza pies server asked this first time here warned that would take minutes know that thanks pointing that certified noob here oreganos stomach almost screamed ohnoyoudidnt hand immediately snatched back menu going straight appetizers boom pretty good four people enough probably favorite dish night since could actually taste chunks artichoke unlike usual artichoke dips that taste like paid bucks cents straight melted mozzarella some reason server decided torture serving both pasta same time pizza even though asked after arduous hour waiting where ready part crowd like moses cherry blossoms instead monster came could pile cheese dripping fatty this goes beyond paula deen buttah level cousins agreed that could have gone pizza same delicious pizza eaten more boxes time waited then little cousins wanted desert they wanted pizookie wish waiter warned ahead time that going another esque minutes actually minutes after ordering time table were full tired being restaurant long restaurant thats small would think food would come faster least they would train their servers more careful about warning customers about time takes certain foods come like other restaurants,dUffgo9Lh_Vk9TLuFR5ywg,dUffgo9Lh_Vk9TLuFR5ywg,3,41088.203252314815,sYPuLHkyWjOjjNPYgrkt-Q,0,0.12443977591036418,0.5199929971988796,0.003205128205128205,0.02564102564102564
270,0,0,upCsX7EzKgqMtUN6PwhMWw,this first time fired craving pizza pretty late hour when they came search places that open that time looked their menu advance their pizzas looked amazing they decent amount choices apart from pizzas well decided with chicken pesto pizza been favorite kind pizza other restaurants would give good standard comparison will definitely that their food amount largest have experienced still pretty hungry after their thin crust pizza however quality food great tasted delicious looking forward trying other types pizza they have including build your kind well their desserts which sounded pretty yummy based what heard that,iNbAht5CVY4KH_cympbHMA,iNbAht5CVY4KH_cympbHMA,4,43249.19938657407,Hh5ZtUanXTARKJ6Bwnj8RA,0,0.24841269841269842,0.719047619047619,0.003205128205128205,0.00641025641025641
283,0,0,cc8V6kbMgmGj9H1QP4z7-A,dont think every experience favorite barbeque chicken salad there alot restaurants that duplicate this recipe never achieve along from that margarita pizza also delicious there many choose from,MVg8_dWzoCtGjBvWCatjjQ,MVg8_dWzoCtGjBvWCatjjQ,4,40880.23359953704,aKY4eFOJeCaXnw1jGPozTw,0,0.35,0.8625,0.0,0.0
307,0,1,9N5GvpXQmiM3Ej79KrGh5Q,after great press awesome reviews heard looking forward dining here first thought that decor urban shabby chic meets goodwill garbage true experience absolutely disappointing have intention trying again were small uncomfortable table with hard wobbly chairs server stopped drink orders however they were diet coke because they only sell glass bottles this explanation lame once ordered pizza never server make other attempt check pizza dropped another server burnt looks taste bring this table posted wellthis pizza tasteless hardly cheese mushrooms were truly only compliment give reason deserves star really dont understand hype this place enjoy gourmet food assume alpo more flavor then pizza dont waste your time money theres plenty other tastey restaurants that area choose from,cs1qJvnWUg_f8g020z_3PQ,cs1qJvnWUg_f8g020z_3PQ,1,41618.00171296296,sWeg9ffWlhbxgaGBuPqgCw,1,0.000833333333333322,0.5758333333333333,0.0,0.035256410256410256
323,0,1,J-bj6U2PG9x7NLu12btEHA,small assuming pizza excellent like real italian thin crust done real wood burning oven slightly burnt crust fluffy edge chewy service prompt friendly wife shared salad which thought little small however lettuce cold didnt come like many restaurants they make their sparkling water which came very cold bottle nice touch wine selection small reasonably priced patio small there early want outside will definitely back,5ykOWYZ44sUvu9qxD8rPeg,5ykOWYZ44sUvu9qxD8rPeg,5,41220.95034722222,lzSNH_h5iqy0SM6O9zdLjA,0,-0.017958333333333333,0.4883333333333334,0.003205128205128205,0.02884615384615384
403,0,1,6OvCsdTgIoajeYutg5S3tA,bianco restaurants italian restaurant favorite best three worlds pizza pasta sandwiches with familiar chris bianco style fresh local ingredients food made from beginning house would definitely worst thing about restaurant trying decide what want could always what though with people love share three things went lunch joshs foraging fowls chicken salad with fingerling potato salad house made mozzarella prosciutto parma special which included fresh made orecchiette pasta with sausage this definitely those meals where know what first because werent sure which dish wanted last longest chef john hall also great addition newest bianco restaurant since farm table background right line with restaurants concept hiring definitely smart move their behalf sincerely looking forward next meal favorite phoenix restaurants,cs1qJvnWUg_f8g020z_3PQ,cs1qJvnWUg_f8g020z_3PQ,5,41327.975694444445,I9u3--BSibni1RAqK1MSmw,0,0.2277210884353741,0.5304232804232804,0.003205128205128205,0.035256410256410256
422,0,3,_-CG6047xg4HuwdQi_x10Q,worth hype absolutely husband phoenix area have been researching best restaurants pizzeria bianco kept popping lists decided personal must list spontaneous date night made pizzeria bianco destination best date night decisions weve ever made seriously pizza shared bianco verde simple incredibly flavorful pizza tasted authentic that when took bite felt like were transported italy usually when were hungry inhale food this time around wanted savor each bite weve eaten kinds pizza from pizzerias from york chicago this have been best pizza weve tasted least atmosphere small cute charming service really quick great perfect date dinner with friends family know this isnt original location actually really surprised this location doesnt have least stars stars around live visiting phoenix make sure visit pizzeria bianco least once your tastebuds tummy will smile thank type pizza that think about after youve check paid walked your back home wishing leftovers well definitely back more,cs1qJvnWUg_f8g020z_3PQ,cs1qJvnWUg_f8g020z_3PQ,5,43155.22734953704,8x4zDoBZ7U6LyNBqPT-ojw,1,0.3107366771159874,0.534920634920635,0.003205128205128205,0.035256410256410256
488,0,0,nsCshFcRe6Ly9Ixj4erz6A,came with husband laws celebrate birthday weeks started with cheesy artichoke bread spread some wings wings have been much better past werent nearly meaty remember ordered spicy shrimp pasta subbed protein chicken delicious shared some sister laws pablo picasso salad which just best salad ever husband shared thin crust pizza with very disappointing others table that ordered deep dish were very pleased with their order dessert were treated pizza cookie with scoops vanilla cream ordered half half peanut butter chocolate chip service good even though large group prices were reasonable portions huge chain restaurants this better ones sure,dUffgo9Lh_Vk9TLuFR5ywg,dUffgo9Lh_Vk9TLuFR5ywg,4,42893.82761574074,gOYgSEbE-Z7cqGsgGW3LBg,0,0.15268170426065164,0.6216207184628239,0.003205128205128205,0.02564102564102564
584,4,1,U6vx8NC2lTTz9ZE_1P-Rtw,arrived resort across street check after long airplane flight half hour before resorts restaurants closed evening missed dinner time flight were starving since hadnt rented vehicle searched yelp places within walking distance that were open late nearby options turned place down street gallaghers tried place first aunt chiladas reviewed separately despite that locations restaurants website stating open until were dismayed find that they only serve alcohol after asked bartender about gallaghers other nearby alternatives told avoid gallaghers like plague funny cabbie from airport said place greasy local favorite decided risk itand glad gallaghers dining room separate from arrived around there were other groups enjoying meals dining room dimly felt like belonged cold midwest metropolis kinda like chicago detroit version cheers which never visited sounded busy happy with loud music that battled with dining rooms music make pleasant cacophony white noise were exhausted seats were comfythe hostess very attentive pushy instantly brought large fresh glasses water food ordered appetizer platter fried mushrooms zucchini onion rings mozzarella sticks wonderful plentiful greasy despite being fried food piping with crispy fried batters husband ordered cheeseburger loved felt yucky from half traveling ordered small spinach salad salad could have been wonderful with thinly sliced sweet onions crispy bacon pieces mushrooms almond slivers oriental dressing side unfortunately spinach beyond seem like been washed mushrooms looked like they been picked from grocers chopped without inspection washing even wiping with cloth swear could bits manure slices below surface salad identified several spinach leaves which were close gelatinous state short service great grilled fried food wonderful atmosphere comfortable inviting will definitely againmaybe their pizza wings learned things never order salad from unless salad always trust cabbies opinion over that competing bartender,5nWfU-qheLL-JzwYgHe_cQ,5nWfU-qheLL-JzwYgHe_cQ,4,41137.20028935185,eFDw1axpJVR2IySnef__pQ,1,0.1613983371126228,0.6027966742252457,0.0,0.0
621,1,1,qdEhxQlEO45W_tuRuTvQMA,what seeing more more restaurants downtown phoenix loving when heard about nook course excited since just went visited other location arrived about saturday night tons traffic knows what valet full problem parked around block walking decor ambience makes feel comfortable colors vibrant subtle fell love with chair table felt like queen menu same plus some additions well already knew order pizza from previous visit arcadia boyfriend decided diavolo sauce pizza with basil somewhat spicy meat amazing ordered short picture have will show just wonderful entree came with leek mashed potatoes baby green beans shared food loved every bite compliments chef were checked times made sure everything needed normally dessert have room tummies lovely friend boyfriends came recommended oooy gooey butter cake yeah made room that sure craving back very soon support this place connected hilton garden monroe check lovely patio dine inside enjoy wonderful meal,PxTKXsdYqoFHWAG2amz0XQ,PxTKXsdYqoFHWAG2amz0XQ,5,42472.29809027778,wdiv0Aw82K1Ic-VzXjYj9A,0,0.33141025641025645,0.5837606837606839,0.003205128205128205,0.016025641025641024
655,0,3,DxXGMs-nnNiauz8BZo9Wnw,upon arrival pleasantly surprised find that they expanded restaurant were seated room back like being restored tuscan farmhouse with candles paintings chandeliers firewood books such table even though still light just after they already candles along with fresh flowers pepper grinder salt this shows much pride owner this restaurant food think best dish table pappardelle with bolognese think they seriously improved this dish this most authentic with rich sauce best have long time just loved thin sheets obviously homemade pasta lasagna verde also very good think they should have just eliminated sauce done more bechamel didnt care much chicken involtini little dense tough precooked then reheated there also sign indicating pizzeria bianco probably because they have wood burning pizza oven however hope this isnt same pizza that people wait over hour their sister restaurant because wasnt impressed with tried margherita crust wasnt that thin crispy bottom sauce great cheese scant very bubbly having lived rome italy guess expecting that type pizza maybe this supposed more like what would find florence however homemade bread olive brought table very beginning just amazing service notch professional waiter well dressed like other staff obtrusive tell timed everything accordingly waiting finish appetizer unlike other phoenix restaurants where have wait order entree avoid getting served fast highlights ambience simple fresh high quality ingredients service will back spaghetti with order meatballs eyed them another table they looked amazing even from feet away,cs1qJvnWUg_f8g020z_3PQ,cs1qJvnWUg_f8g020z_3PQ,4,41378.59961805555,9KGSlYAYkI7xt1xrA4rrcQ,2,0.22461257309941518,0.5434774436090225,0.0,0.035256410256410256
669,0,6,2pgcMQGmGYlerk7h-EUHSQ,finally have found sushi spot arizona after moving from california trying different sushi restaurants area thought were doomed mexican food pizza forever literally said this last place would sushi wasnt good then would throw sushi towel delicious authentic attention detail fresh owner sushi chef entertaining really takes care customers everyone restaurant brought complimentary lightly seared tuna tataki with ponzu thanked personally coming hesitant sushi with black rice officially converted while white rice that chewiness bounce back black purple rice tender with just right amount resistance complement melt your mouth buttery fish felt less heavy than white rice fact that healthier makes feel little better about stuffing face with sushi fresh wasabi worth officially spoiled there going back that powdered crap such fresh bite doesnt overpower sushi like normal powdered wasabi does also city roll spicy tuna roll nigiri they accidentally brought crunchy crab roll keep extra charge course everything amazing also spicy shrimp tempura ramen eyes were bigger than stomaches togo bags were sumo wrestlers only wish they would shrimp tempure side have sitting ramen because soggy quick would probably just stick with sushi next time dont parking parking meters free during weekdays parked front courthouse block away free lots open spaces park will back,S-oLPRdhlyL5HAknBKTUcQ,S-oLPRdhlyL5HAknBKTUcQ,5,41803.130381944444,7bhQQHkTdtOucIpdfLAnSg,1,0.14453869047619047,0.4508928571428572,0.0,0.003205128205128205
708,0,0,fxWdJGO8DY4EkWCSlUvCtQ,awesome pizza will definitely back when come back arizona being from north dakota dont have good restaurants this place will list future visits owner super nice patio seating great crust pizza perfectly toasted perfection some amazing sausage italian bacon,5ykOWYZ44sUvu9qxD8rPeg,5ykOWYZ44sUvu9qxD8rPeg,5,42523.11040509259,ZpM8Nf0WLa8pbpHxZwmz8Q,0,0.4575757575757576,0.5492424242424243,0.003205128205128205,0.02884615384615384
735,1,1,WMA20vIWDnoRp41bVbEX2w,this best middle eastern restaurant eaten inside small plaza thats nothing flashy step inside like walking into vacation place small cozy elegant staff friendly prices kinda high waitress warned that arabic coffee strong sweet brought tiny expresso sized coffee assumed getting full however price reasonable compared real super yummy just right sweetness that eaten other persian restaurants such ameera broadway that they have messed falafal before with terrible taste that wellhow mess something that popular pizza them saharas falafal generous yummy their hummus thick creamy their pita bread warm made perfection ordered tabouli salad appetizer first time trying tabouli very flavorful could have been bland salad cook must have lots experience with mint lemon juice exactly them dragged husband this place trying convince them that theres nothing wrong with foreign food know sometimes have relatives whose taste buds arent adventurous yours made believers them,rhKzcgMm8CDhu7RZz_XxqQ,rhKzcgMm8CDhu7RZz_XxqQ,5,41141.61591435185,SX7xBRFGfrEjfXDqw0d-ew,1,0.09874603174603175,0.5541904761904762,0.0,0.0
738,3,1,yeBrx8uuLHibrqytzSlmVQ,chinese always been tricky cuisine review admittedly this partially ignorance thanks parents excluding chinese from five restaurants kept continuous rotation during family dinner outings also with fact that chinese food least american influenced style were most familiar with hasnt really evolved much there corporate chains that suburban families flock well these called modern spots that simply replace dragon with ikea furnishings screen food really that different when think about pizza burgers even mexican food have their fair share changes over years rarely hear about high chinese restaurants have found much variation types food available pretty traditional stuff which probably once exotic appeal slowly waned last fifty years fact that roughly third them always named great wall doesnt help matters much wait where dragon palace little family owned chinese restaurant that from what understand been around quite some time located seedy looking plaza chinese places that popped with some decent yelp reviews thought give them complimentary upon being seated nice touch girlfriend ordered sampler platter which consisted wontons honey dipped chicken legs rolls jumbo fried shrimp unfortunately wontons tasted stale they been sitting around long rolls werent opinion these basic most basic items something wrong with them thats probably good sign hell vietnamese thai crew people that shamefully stole these items from chinese menu them right cant this place entrees were delivered shortly thereafter quickly slapped down edge table server similar barista plunking down couple iced coffees counter before running back make another drink during middle rush typically when chinese usually play safe ordering beef broccoli rarely deviate sheer fear however once attempted change things ordering their kung chicken took about three bites immediately surrendered still cant finger what something whether peanuts some kind strange oyster like sauce just gave meat this very bizarre aftertaste that strongly disliked girlfriend ordered chicken chow mein half offered pity immediate dismissal wasnt nothing that would order myself once again cant really finger just seemed rather bland also receive traditional bowl rice rice rice make microwave minutes there want they serve couple complimentary banana fritters meal which admit charming move especially since most chinese restaurants dont seem offering desserts they were okay probably would have tasted better fried bananas typically then again they were free guess shouldnt complain overall really impressed which really wondering serves best chinese food phoenix allegedly according girlfriend best chinese restaurants actually found mexico places belief that colleague mine also strongly supports from what been reading theres actually quiet movement central phoenix give chinese cuisine boost although havent quite experienced this just ultimately this just wasnt type place although reading some reviews they seem have their fair share longtime fans take opinion with grain salt this case grain,fnaDx7UD4MiodQlgYHDwsQ,fnaDx7UD4MiodQlgYHDwsQ,2,42787.00001157408,TCPLaprJm4FFei2DkW6K6g,0,0.12764050858438614,0.42592484612892767,0.003205128205128205,0.003205128205128205
757,1,2,AOQuV8doSkSyUMgT-W0xCw,grazie town scottsdale hidden pizza restaurants here valley everyone knows about pizzeria bianco cibobut money grazie puts pies that just good better dare came here over weekend pizza decided complimenti alla mama sauce mozzarella ricotta salame parmigiano reggiano over selling this when have been three best pizzas ever life also enjoy wine list very italian focused service pretty good youre coming first time cant leave without having dessert dont worry about picking have order dolce della casa slightly charred sweet calzone filled with nutella bananas topped with vanilla cream summary getting hungry just writing this review cant wait back,jG1jcAeDw0pZTHCNC5kw_w,jG1jcAeDw0pZTHCNC5kw_w,5,41834.74480324074,DvdVXZuixUz7651_hrGmEg,0,0.3243589743589744,0.4525641025641027,0.0,0.003205128205128205
