,funny,useful,review_id,text,business_id,ID_bus,stars,date,user_id,cool,polarity,subjectivity,restaurants_sentiscore,restaurants_total_business_score
4037,0,4,XucA4TxxSbjIlu-X7lHscQ,loooooved this hotel loved like wish business trip longer that couldve stayed here longer loved first convinced kimpton only hires friendliest most genuine people ever from minute arrived greeted with such warmth from valet well front desk staff were more than helpful with bags getting checked quickly price difference between valet self park dollars made sense valet they were friendly quick bring rental helped with many bags which much appreciated room studio suite huge soaking best surprise ever especially after long days meetings everything immaculate incredibly comfortable room perfect size despite being room near elevator never heard outside noise either hotel itself located such prime downtown spot near restaurants bars decor also chic especially area near restaurant where wine hour held hello fireplace dreams wine hour featured light bites well flatbread pizzas which nice much buzz while enjoying glass they check room keys before serving drinks make sure bring yours with dont have your room miss second best hour first situation confusing actually located hotel across street actual where take classes have access shitload space equipment feel like youre locked dungeon while trying workout loved workouts there access taking classes even while away from home simply signing bringing room huge huge amenity that truly grateful overall experience perfect huge thanks amazing front desk valet inner circle rewards treats that were left need totallyyy increased after macarons that were left those took care during wine hour cannot wait come return,WU4wM-uD1INThG6F3sGzCQ,WU4wM-uD1INThG6F3sGzCQ,5,43152.76298611111,l0qrUfq4dboSV-A7lvxBFQ,2,0.30607638888888883,0.5193617724867725,0.0,0.0
4050,1,0,Ax_iFbrCMEb2-Apt_j_tpg,over rated pizza restaurant very clean service great food just other pizza restaurants that much better valley however would like their managers info because doing great,cs1qJvnWUg_f8g020z_3PQ,cs1qJvnWUg_f8g020z_3PQ,2,42808.076944444445,I5dsfjZ_SHyVfLwJ5BhVSQ,0,0.4903333333333334,0.657,0.003205128205128205,0.035256410256410256
4060,0,0,wJpS_9iF46xhnkFNZLn1_Q,first love maizies staff tina michael maizies joel always friendly helpful truly real food antipasto appetizer more than starter only beautiful wonderful good entree pizza some best around good sauce wonderful toppings love burgers mondays regularly priced burger only with fries happy hour rounds with beer bucks great meal good salads that meals them selves glad places like this help fight chain gang restaurants,NPiLy71qqXzb45k9eQOgCQ,NPiLy71qqXzb45k9eQOgCQ,4,40184.1009837963,BOoCgJ8mkFV5k6O35yIAww,0,0.5460526315789473,0.6715924426450742,0.0,0.003205128205128205
4084,0,0,HVWWcY02nJYc9cYJ40zrHg,have known about this place quite some time theyre practically famous fact that they have entirely separate vegan menu relaxed unpretentious atomosphere refreshing most restaurants down town phoenix easily feel place walk with jeans shirt personal opinion self proclaimed crust snob pizza absolutely phenomenalwe mediterranean also could pass opportunity their vegan cheesecake made with cashew base decadent balanced hint cinnamon divine while were kept entertained wonderful tunes michael jackson journey many other classics while this wonderful rite what took experience above beyond when owner patricia came over table struck conversation what started simple like vegan cheesecake bake myself into amazing talk about passion restaurant food community years open shes obviously doing something right only lived closer would probably never leave second thought probably better that dont this place worth stopping even your,7eQoxWr9RzyCB9IFvqHUPA,7eQoxWr9RzyCB9IFvqHUPA,5,42881.01054398148,cz8kD4un4ldMHJotLy8EFw,0,0.22776052449965492,0.6006556245686682,0.003205128205128205,0.00641025641025641
4087,0,0,g-XIMV6hBu12SsuPISfAYg,visiting from california bill ultimate host food excellent salads were fresh awesome pizzas were crisp inventive wine delicious very reasonably priced served correct temperature boot great little space city full cookie cutter restaurants this unique recommend highly,5ykOWYZ44sUvu9qxD8rPeg,5ykOWYZ44sUvu9qxD8rPeg,5,42004.102997685186,qtLDcR5dXsit1fJAA0s8-w,0,0.44673076923076915,0.7720512820512819,0.003205128205128205,0.02884615384615384
4098,3,2,xnI-jeNeP4bzpGqpDvc4_Q,this place blows service slow grumpy pizza thin chewy overpriced rest menu small portions again overpriced nothing special tasting about anything served here either most tastes like stouffers frozen food italian gramma wouldve these guys head with meatball real italian restaurants opened area this place would sink like brick just like brick they stomach,EgwGTDZ705TwudPJwAY0yQ,EgwGTDZ705TwudPJwAY0yQ,1,40492.679710648146,-3ftjzYHSLAGAniH--GkyA,1,-0.013265306122448996,0.38877551020408163,0.0,0.009615384615384616
4111,7,9,mJPKtQBnXcTrRdH6smu6Mg,there those restaurants that when walk door know have found your place thing impossible what exactly gives this feeling when hits take note such case pizzeria bianco love this restaurant began years with first trip phoenix having just plane time kill before check stopped trader joes nearby grab some staples needing lunch vaguely remembering reading about chris bianco believe were enamored with canned crushed tomatoes before even came across restaurant decided grab bite that first meal perfect harbinger things come were taken place vibe food that there times days wasnt phoenix lack other good restaurants rather this place since then bianco must stop anytime phoenix food simply that good this review covers last visits simple local greens described super fresh mescalin lightly dressed perfect started table caprese often described mozzarella with seasonal preparation every time order either perfectly ripe yellow heirloom tomato with slices house made cheese mozzarella creamy firm texture tomatoes that perfect combination acidic sweet which cuts richness cheese basil leaves layer affair supplied bread perfect companion lightly dressed olive spiedini prosciutto check fontina cheese check fired oven served arugula check check check salty crispy taste prosciutto melds perfectly with rich gooey fontina hell sharing rich that arugula serves perfect palate cleanser between bites special salad this best frisse endive lettuce gorgonzola onion candied walnuts perfectly ripe peaches combined make best salads have ever everything played perfectly each other peaches things tied together perfectly dressed perfection each bite ordered procciutto melon honeydew cantelope combined with crispy prosciutto strips were interesting tasty take this classic melon again perfectly ripe crunchy were perfect pair salty crispy prosciutto parppardelle giant thick ribbons pasta cooked perfectly served with classic bolognese sauce sauce nice bite thick hearty suspect alot parmesan cheese went into pasta great mouthfeel another perfect dish artisinal spaghetti again perfect dente pasta served with classic pomodoro sauce sauce most ingredients perfect just right balance acid sweet something special pizza lets face dont beard award your salad imho pizza here elegant simplicity them couple that with premium ingredients have something special sonny tomato sauce fresh mozzarella salami gaeta olives each applied right proportions crust crisp doughy that makes sense perfect brininess olives plays richness cheese salami sauce good sauce does binds together wiseguy this nirvana take perfect crust wood fired caramelized onion lets ahead smoke mozzarella throw house made sausage have best pizza have ever tasted hard describe good this pizza really sausage nice fennel taste smokiness rich mozzarella simply fantastic combined with crust holy pavlovian reaction drooling margherita this humble usually what order when trying place super basic very clean impossible hide ingredients nice benchmark since pretty much universal bianco hits this park crust above sauce basil mozzarella perfect rosa wild card pizza pistachios pizza what worked pretty basic well with clean flavors pistachios provide nice crunch parmesan plays them generally front part from there watch them make pizzas decent draft beer selection well service super friendly point every time went scottsdale location that expanded menu quite frankly through most good,cs1qJvnWUg_f8g020z_3PQ,cs1qJvnWUg_f8g020z_3PQ,5,43106.88,T7UOTXOsi6ZdJkzy8czTMw,6,0.3987006079027356,0.6235992907801419,0.0,0.035256410256410256
4125,4,12,pKoG2TnS-zNLYfWXU6jTcw,really enjoyed certified local first fall festival with about local vendors restaurants shops feel good about spending your money with someone lives just down road from always love local business doing well thats what call winning sampled foods from urban cookies nami green culinary dropout spinatos pizza other random food stops which cant remember many samples were some were some spots even handed coupon discount come check their full menu local shop cant wait join next year more locals doing what they best providing great service personality local community happy yelping phoenix,mQmxM0uidU-DhiUKwZVx9w,mQmxM0uidU-DhiUKwZVx9w,5,41298.83255787037,8SgjU2fID9VqKQooFt1DIQ,12,0.2356280193236715,0.34987922705314,0.003205128205128205,0.003205128205128205
4198,3,4,cSywT0MQ2bOE94HFOeU5qQ,when lived tempe from family used frequently visit this devil location because always were impressed with quality food price service after returned living area after years living another state made point return hangout spot dont know what happened five years between visits quality fallen badly that nicest possible word poor quality began moment walked door host seemed about enthusiastic there when colonoscopy greets with many hello thanks coming welcome devil today even slight acknowledgement appreciation being there then have month percent restaurants visit least want booster seat high seat devil they bring after minutes damn thing without buckle keep safe then ordered appetizer meal after minutes waiting without interaction with waitress which four empty drink cups thirst began kicking woman comes notifies they really busy back give this excuse fair amount consideration there line people door however along with there other family there whom were dining already when arrived then finally pizza plates tosses pizza down front walks away when finally returns have plates which responds dont already have them suppose asked plates health they were already table must have been invisible ones that could noone else could topping pizza lukewarm like been oven half hour more finger full barbeque sauce entire pizza ordered chicken severely lacking toppings dont wrong dont expect pizza loaded company dump every ingredient they have spending dollars pizza sure hell dont want just dough crust nothing else least make damn sure thing barely warmer than room temperature beyond disappointed with this experience complains about every little detail generally easy person please such dont like hand negative reviews really will only experience completely undesirable this experience ranks just that wanted treated poorly upon arrival have lengthy unnecessary wait have basic dining items refills seat have just gone through drive through carls least there know food will conclusion couldnt wait back devil after five years will long time before back again,dSEcQPPUlATxZf5pvN_t5Q,dSEcQPPUlATxZf5pvN_t5Q,1,41742.08929398148,PAc5tV1UpbQmvxEHXKdNKg,2,0.028552009456264796,0.5332978723404255,0.0,-0.00641025641025641
4204,1,1,91vwvz-1OcxFa_pAVfyNmA,lived just south this shopping center months have been regular since whether shopping walmart eating many restaurants find myself happy valley towne center daily everyone talks about norterra when tell them where live well think this place better more useful overall best happy valley towne center rays pizza greek pita logans roadhouse jersey mikes shanes shack cold stone creamery starbucks lowes barnes noble sports chalet worst happy valley towne center mcdonalds inside walmart walmart olive garden carls applebees robin panda express fridays super cuts walmart cares bajio hall frames cares about these,6s5X0Z99JkimFIAtkdb04g,6s5X0Z99JkimFIAtkdb04g,4,40875.92292824074,U7NLhaVfOJrHb9XLsZbJnQ,1,0.20331890331890332,0.44493284493284485,0.003205128205128205,0.003205128205128205
4269,0,0,AdN0IKDlE8Quv0Cz_iMIwA,vegan love having vegan options they just changed their menu miss pizzas prices high find myself ordering much food when there appetizer meal drink amazing soynami dont care mock meats that seems direction these restaurants headed vegan because dont like idea eating animal products,5FIOXmUE3qMviX9GafGH-Q,5FIOXmUE3qMviX9GafGH-Q,3,41393.82256944444,fJRE84UDvsgxjlm2e3MU6Q,0,0.36500000000000005,0.5599999999999999,0.0,0.003205128205128205
4331,2,2,hCPF-wcYv0qLmGyK_BAg-g,great atmosphere happy hour menu prices patio happy hour service little slow everything eventually pizzas really light fresh menu this location pared down compared columbus sticking more core basics there still decent variety offerings they have some pretty cool different specialty cocktails both times been there manager stopped asked everything marcellas nice addition fashion square alternative major chain restaurants there,5SEwzlWlrxSVyZx3IgXwLg,5SEwzlWlrxSVyZx3IgXwLg,4,40140.690775462965,Rs-HbyVraRCP2X4ey1t-IQ,2,0.2924074074074074,0.6703703703703704,0.0,0.0
4351,2,2,amR382ydZwYW0osziLmg2w,cant believe taken visits this oreganos finally lazy type review this place perhaps overall indifference everyday ness quality this place that explains food stars service stars atmosphere stars parking star oreganos isnt terribly good falls middle average lunch dinner option portions here quanity does equal quality find infinitely better than most other italian chains barfy olive garden macaroni grill carrabbas quite level maggianos fornaio food here although there standouts alfredo dark pasta with poblano peppers lady scampi pasta pizza cookie whatever called italian fried potatoes that last item their cutesy name waffle fries being waffle whore that have these quite good baked sandwiches beefstro stuffed turkey being usual orders pizza well being thin crust lover find crust pizza heaven pizzeria bianco have better tasting texture almost little thin read cheap here kind like notebook paper know because tried salads here warned cant comment taste though because havent them swing jazz motif tomato sauce cans loud shirts charming campy kind what like most about this location they preserved damen herren bathroom signs from when used some kind bavarian wonderland among cons here parking nightmare sometimes hellish hour plus waits mondays even this place always packed understand there only parking spots here restaurant that easily seats over they must expect their customers carpool together mini vans even they should know that central phoenix would caught dead mini parking shortage caused nearby businesses post bitchy signage warning oreganos patrons park there resulting traffic boobytrap that drivers must dodge slowly moving cars waddling oreganos customers weave tiny parking leaks onto staff here always quick freakishly friendly cheery kind like drones jamba juice cold stone creamery kind cute borderline annoying that seems trite there plenty holes other restaurants complaining there have exactly great will back soon visit coming next week stalkers care phoenix fire department does here often fact when melinda sees fire engine parked outside always requests table close firefighters thinks those guys fuego,dUffgo9Lh_Vk9TLuFR5ywg,dUffgo9Lh_Vk9TLuFR5ywg,3,39182.91594907407,Yej5B4nd8PqpHMQcmCTDrg,3,0.14356884057971014,0.5478260869565216,-0.003205128205128205,0.02564102564102564
4358,1,0,1qLVCD21dQMiYXzU5Gc5pw,defalcos italian grocery best best fresh gets straight from deli been italian delis bakeries restaurants this tops list cant wrong with anything menu when asked cashier what thought would good said throw dart board happy wasnt kidding after youre done eating pick something from deli take home dinner ricotta mozzarella salami pizza dough tomato sauce raviolis name they probably have just wish closer home everyday,r5PLDU-4mSbde5XekTXSCA,r5PLDU-4mSbde5XekTXSCA,5,41298.7602662037,cIIloSzVVQBkW2-XuxCq9A,0,0.32999999999999996,0.45999999999999996,0.003205128205128205,0.01282051282051282
4364,0,0,cEIi9oinJ_moaKloe3Y24Q,were from northern california finding good pizza almost mission drove miles find bosco food disappoint outdoor patio seating nice bonus aware that scottsdale most restaurants button tight sure allow enough time order before closing arrived chilly reception person waiting splashed wine into glasses ended with some jeans plates dishes were removed without asking before finished eating since others yelp have praised service were chalking experience poor timing,5ykOWYZ44sUvu9qxD8rPeg,5ykOWYZ44sUvu9qxD8rPeg,4,42088.64497685185,ockk8AVdgSmxEwQZHmPD-g,0,0.15238095238095234,0.6138447971781305,0.0,0.02884615384615384
4370,0,2,j71lNzqe5yv_0Gs_yhiyBw,away pita jungle favorite hummus eaten pita jungle many time probably times last month this location food consistently very good there some things dont care menu they have some consistency issues lavosh pizzas been times when lavosh pizza topped with cheese that choke melted cheese goes down fills your throat been times when cheese just right guess fact that never been little good thing because variability that dish some other dishes dont care just stick hummus mention love their hummus lavosh schwarma wrap typically salad half wrap restaurant then have nice meal next roughly wrap cant wrong getting meals clean people without lots piercings tatoos working restaurants hygiene issues piercings pita jungle tends attract workers have more tatoos piercings other things just dont particularly enjoy ambiance goes that course very personal thing give them rather than stars that said willing with those things that actually really bother because love food haute cuisine this price point pretty darn good,p-8AMN9Q0qwym-3Pdle20Q,p-8AMN9Q0qwym-3Pdle20Q,4,40057.66751157407,zlf9A6EOSMsLPPi1k0VHiA,0,0.21676892551892554,0.5318437118437118,-0.003205128205128205,-0.003205128205128205
4375,2,7,DuMA6rU07_khtMUUYRyhiA,been wanting pizza heaven while huge down food decent great didnt even everything ordered when asked server about response take what didnt check think service horrible help myself their back area then check register front because server disappeared place empty here server when dont have anyone eating your restaurant should above beyond taking care customers wont back many other fantastic independent restaurants this city waste time pizza heaven again,7eQoxWr9RzyCB9IFvqHUPA,7eQoxWr9RzyCB9IFvqHUPA,1,42122.12708333333,SpwI8V8F199kF1s2i1PpZA,3,0.04900793650793652,0.43611111111111117,0.0,0.00641025641025641
4398,1,0,nsXAnIevsnvbEB05KMxq7A,found this place couple months hands down best pizza arizona come from east coast where pizza invented bosco pizza rivals best pizza restaurants there including pepes service always great pricing very fair bill owner super friendly cares about what does there magic because blend cheese sauce dough looking best pizza arizona better this place compare rest best,5ykOWYZ44sUvu9qxD8rPeg,5ykOWYZ44sUvu9qxD8rPeg,5,41744.964212962965,0SHF0V1bBdkc3wA2puOZ3A,0,0.6602525252525253,0.5368686868686868,0.003205128205128205,0.02884615384615384
4401,0,0,MNdizsRvUy4dDVFKSV5GEQ,first time there celebrate birthday event party never again brought special cake that birthday person requested before even down were told rude manager host that outside dessert aloud they would make time exception came across doing favorite didnt even bother happy birthday care that were first time customers that will returning pizza worth food good best meal have ever market pasta nothing rave about worth that price there plenty good restaurants with great service phoenix that could have gone example federal parlor,cs1qJvnWUg_f8g020z_3PQ,cs1qJvnWUg_f8g020z_3PQ,2,42218.98336805555,Cg9xgFaNmHxnBK4_zptEZQ,0,0.3929705215419501,0.47335600907029474,0.00641025641025641,0.035256410256410256
4425,0,7,gZ3xbewPz9yTQJP90Z6oMA,been coming green years found that they opening location phoenix this good news because friends fans this place food here awesome another great thing about green they conscious they biodegradable products they serve organic natural beverages have stevia sweeteners here some items that tried green edamame with seasalt squeeze lime artichoke gratin very easy tasty flavorful green hummus yummy eggless rolls samosas good similar indian restaurants jerk tofu salad very healthy even without faux meat tofu spicy peanut salad very tasty drunken mushroom noodle bowl always order this singapore tofu noodle bowl same here thai peanut noodle bowl roommate addicted this likes with fried tofu coconut curry bowl diablo bowl delish crab puffs mums meatball okay argentine delicious tsoynami delicious chili fries spicy peanut tofu havent tried flat bread pizzas sure will once they open location,5FIOXmUE3qMviX9GafGH-Q,5FIOXmUE3qMviX9GafGH-Q,5,40455.190254629626,nXMMoDzXRByQiWH9cf-FAQ,5,0.29946969696969694,0.5517676767676769,0.0,0.003205128205128205
4480,0,0,yBAajU-LK3PozNdQJXI0sQ,grazies food great servers very kind well versed menu appetizers very delicious their caesar salad particularly fantastic cannot wrong with their pizzas really like sofia cinque formaggi grazie honestly best restaurants greater phoenix area very comfortable nice atmosphere delicious food good service highly recommend grazie anyone interested exceptional meal,jG1jcAeDw0pZTHCNC5kw_w,jG1jcAeDw0pZTHCNC5kw_w,5,42048.566875,nolZg5wle76F0KooxEE2XQ,0,0.5384444444444444,0.746,0.003205128205128205,0.003205128205128205
4491,1,1,qb1FUADGl-g8nJISaDvXig,most scrumptious pizza have ever tasted truck beats many traditional pizza restaurants well tried hottie this past friday food truck friday although serrano peppers jalapenos were spicy expected sausage crust cheese were deeelicious drooling just thinking about cant wait next food truck friday only stomach were enough pizza people short leash very happy,scoJNOqcw2peNlO31UYTaA,scoJNOqcw2peNlO31UYTaA,5,40959.278495370374,OyLtK_Q2I4Jw0rtfFnLfhg,1,0.16499999999999998,0.52,0.003205128205128205,0.003205128205128205
4540,0,0,ucN-PbfzHvZ8ClItoBejtA,hate restaurants harbor there only couple terminal causing them quite busy with people have time kill this isnt humble pies fault while have wait little hostess tried find table quick could pizza surprisingly good surpassed expectations airport dining pesto chicken wife sausage peppers ingredients were good plentiful wife really liked sauce over priced thats expected from airport restaurant enjoyed food enough that think might have regular location scottsdale,0h5yI6np7weAVH0jsjHqPw,0h5yI6np7weAVH0jsjHqPw,4,42105.09017361111,osjo3TMcfQ3mEC6Y95E79w,0,0.07470238095238092,0.5876373626373627,0.0,0.009615384615384616
4580,1,3,M8J107ovvwjuTtKZOcQxMw,fantastic stay beds were comfortable they have things that they borrow such iphone charger forgot yours also left toothbrush they brought toms preserve toothbrush everything quality know best part pretty pool pool happy hour every wine flatbread pizza more wine this plaza that other things such golds couple restaurants when stayed here drive most places walkable some pizza places looked since pretty central downtown even close club want nightlife phoenix highly recommend hotel palomar phoenix everyones friendly just note parking about,WU4wM-uD1INThG6F3sGzCQ,WU4wM-uD1INThG6F3sGzCQ,5,41670.22914351852,kaKEer3UR5utYZsgp2tgPw,1,0.30066666666666664,0.5776666666666667,0.0,0.0
