,funny,useful,review_id,text,business_id,ID_bus,stars,date,user_id,cool,polarity,subjectivity,restaurants_sentiscore,restaurants_total_business_score
2575,0,1,RXvw3QXk7fFVhCO3xcziAw,love enchiladas they favorite mexican food when this place thought what enchilada only place think blew mind coming from should expect specialty restaurants that specialize type food only cheese meatballs phoenix anyway friend stopped there whim surprised amazed good this concept really line style read subway where pick your tortilla then your meat then your toppings slide down ordered enchiladas first tortillas half wheat half corn they super soft chewy with soft texture next chicken then cheesy potato fillers both delicious gadzooks offers vegetarian options potato cheese filler second spinach then topping green salsa please some cheese into oven goes warm crisp cheese just like pizza last time there tried tortilla soup love tortilla soup kinds types this rich perfectly seasoned will definitely again,fbQaKW0Lte0JQ_opbnjdKg,fbQaKW0Lte0JQ_opbnjdKg,4,41533.09855324074,7Df2b1aAe2JSts_46HubsA,1,0.1403256704980843,0.48467432950191564,0.0,-0.00641025641025641
2593,0,0,63TaGWeIPv8v4d7R_ZQ3tg,first time chris biancos pizza restaurants wiseguy pizza very tasty pricey very good margherita pizza average best nothing special very much flavor very skimpy basil worth they have very good wine selection average restaurant prices overall pizza average better pizza federal pizza,cs1qJvnWUg_f8g020z_3PQ,cs1qJvnWUg_f8g020z_3PQ,3,41415.87094907407,YdUJ6XqzWJpIs_2m8g3pwg,0,0.3169387755102041,0.3874829931972789,0.0,0.035256410256410256
2619,0,0,T1Oxo-ZoFnY6kOSRRDd4Xw,checked this place sunday afternoon lunch quiet busy inside outdoor seating packed only table that left directly were bummed about that nice afternoon were seated really small table back room dont understand nice restaurants seat people tables that barely hold food free fresh bread that they give really good texture flavor amazing ordered mozzerella salad biancoverde pizza share salad fantastic liked pizza thought that would have been better crust little more cooked middle pizza otherwise quite good server nice attentive first wait about minutes attention check overall like will back more items menu,cs1qJvnWUg_f8g020z_3PQ,cs1qJvnWUg_f8g020z_3PQ,4,41757.19578703704,vuTVFuI-puYDKVSn4c-5qg,0,0.2763888888888889,0.5135802469135803,0.003205128205128205,0.035256410256410256
2630,0,5,433030EhP7oa-Ut0A5GFlw,didnt know what expect first when first tried this place given fact this place been several different restaurants last being pizza spot great experience first time came again second time chicken verrry delicious service great friendly location very clean youre looking some good area this great spot least chicken,hb96ToDVKWQkAj5h-UB5Ow,hb96ToDVKWQkAj5h-UB5Ow,4,42454.02982638889,vXoplOruH7ko6TM0uqW9MA,4,0.24715686274509807,0.5427450980392157,0.0,0.0
2654,0,2,ai5Sus0xATcC7LWSl2ujjQ,usually hesitate restaurants that attached hotels staying stormy outside popped here dinner joke this some best food server very personable helpful well thanks victoria only speak what that notch wood fired olives thought maybe impressed with probably these little balls soaking meltlicious puddle seasoned butter generous portion crostini accompanied them perfect vehicle soaking leftover butter pizza bianco funghi dont know describe this delicious crust maybe little sweet right trapiche malbec just this meal would have been perfect exactly half other half cold next night because well bachelor guess still good,PxTKXsdYqoFHWAG2amz0XQ,PxTKXsdYqoFHWAG2amz0XQ,5,42571.133993055555,0mlAOLpot-TE7m_HUeIPqQ,0,0.25249433106575964,0.5163832199546484,0.0,0.016025641025641024
2757,2,8,aMsSYClWhE5DgMpP89xguA,finally visited grazie this past tuesday after years wanting months perhaps year giftcard from fave radio station thought that before grazie closes like many restaurants doing these days should grazie ever find itself closing will because lackluster food fell head over heels love with their cinque formaggi watched pizzaiolo knead hand toss dough roll thinly then grab handfuls mozzarella gorgonzola sigh ricotta sigh provolone parmigiano reggiano garnished pizza with sprig basil leaf some olive then slid into brick oven minutes later after took couple photos bite first slice pizza eventually three scratch that four slices couldve sworn walked through heavens gates love cheese sauce thin crust pizzas must this grievance that body crust didnt stay crispy long that understandable with cheese placed onto parts crust stayed very crispy though worries concentrated these areas while ditched soggy parts there throw cheeses away well maybe mozzarella which took rubbery texture leftovers reheated well toaster oven next good thing know able sample sips three white wines before settling with glass anselmi this paired very well with slices cinque formaggi note asked table bread some olive herbs which server obliged with platter spongy bread toasted bottles olive balsamic vinegar eating spongy bread unless ethiopian injera toasted took pieces home toast them later they were really good with ricotta medjool dates some pistachios friendly service clean restroom tables space that matter indoors visited around practically empty there waiting partner arrive besides very quiet wager that this place pretty noisy when packed ample patio space though pizza didnt heat well home better plan sharing pizza restaurant that there wont leftovers toss next,jG1jcAeDw0pZTHCNC5kw_w,jG1jcAeDw0pZTHCNC5kw_w,4,39990.46748842593,M9rRM6Eo5YbKLKMG5QiIPA,8,0.17366666666666666,0.4576666666666667,0.003205128205128205,0.003205128205128205
2791,0,0,sYZAMJ-bnHzR8tz0Hvn1wg,nicer ambience than corner pizza place food generally really good with nice size portions variety menu excellent have been back will continue very picky about restaurants frequent this place would recommend casual dining,VoXUt6TIJWyIf_lihbN5xQ,VoXUt6TIJWyIf_lihbN5xQ,4,41663.87851851852,5x8J-xa-e7Bfd5wl-Rs7nQ,0,0.3,0.5809523809523809,-0.003205128205128205,-0.003205128205128205
2799,0,0,7eFHMEjzOEiFn28u-AerYA,pizzeria bianco widely acknowledged some best pizza best some reivewers nation sure what except terrific princess went second location town country shopping center biltmore area walked right location wonderful setting nice looking onto courtyard appears there tables weather during visit ordered nice italian wine negroni both were fantastic meal started with small complimentary bowl five small kalmata olives slices their house bread with bowl olive nice touch ordered their famous wise ordered sonny wise white sauced based with wonderful fennel sausage from shrieners local meat fennel roasted onions wood fired pizza excellent however actually enjoyed sonny more sauce based with soppresseta imho best pizzas ever finished meal with flourless chocolate cake very good with vanilla sauce service delightful server attentive without being face loved small touches such real silverware oneida attention detail made bianco success humbled able join chorus people sing restaurants praises slainte,cs1qJvnWUg_f8g020z_3PQ,cs1qJvnWUg_f8g020z_3PQ,5,41459.62501157408,cQK407Dkqyi9pf4Bqtum0w,0,0.4234920634920634,0.5924889770723104,0.0,0.035256410256410256
2803,0,2,7yDXzjzJuPmqJI9B5JeTwA,like many restaurants terminal four humble started restaurant town opened outlet airport food here with what theyve other restaurants that makes humble standout airport since traveling solo service great especially since this airport they have quick turnover seats mushroom pizza good something usually order honestly probably wouldnt again good could appreciate what guess thats good summing humble terminal four enough escape from traveling might forget youre airport just looking quick mouthful actually enjoy your meal enough order something different know will good back hopefully soon,0h5yI6np7weAVH0jsjHqPw,0h5yI6np7weAVH0jsjHqPw,4,42430.16825231481,l2BRqPLJAthlZXW6Te0CUg,1,0.23958333333333334,0.5237499999999999,0.003205128205128205,0.009615384615384616
2813,0,2,EE2bvJE0ouIpx-dNZQ0vog,here perfectly blended flavors from local organic personally grown ingredients wonderful lunch then amazing chat with owner husband wandered later lunch yesterday idea that this pizzeria bianco close trader joes whole foods that frequent outside courtyard lovely short carefully chosen menu need since wary didnt know where kept safe with just caprese salad handmade mozzarella tomato basil olive with glass sparkling water husband ordered chicken salad with fingerling potatoes mayas vegetables this chicken salad will change your entire mind about what chicken salad should gloppy mess mayo chicken chicken amazing real chicken little cubes apple subtle herbs mixed when were sitting chatting after dinner just getting bill anxious leave after such lovely lunch dappled spot waiter joking with about whether liked everything since cleaned plates were raving about food motioned chef apron said this chris place thats chris bianco heard about pizzas heard about biancos passion perfect ingredients tour took queen creek olive mill where they described only certain olives crushed make olive restaurants person even more chris bianco with real passion making wonderful honest food knows where each ingredients coming from always looking improve shared story this location real place heart efforts best ingredients refused take credit amazing chicken salad saying that just ingredients together real star this well well grown chicken much credit flavor chicken farmer sorry forgot name just here youll some every restaurant wants able tell some story impress with their local this specially imported that every detail here that wont even show menu looked after give example caught bianco just after been having long discussion about where salt salt from glendale even believe tell gets prosciutto gets from where growing tomatoes california basil back porch this very restaurant this location where chris bianco comes cook create dining room back filled with personal items many paintings wall done father leonard bianco large table specially made under came from childhood home real place heart passion heart shows food missed wine this time told they were carefully picked good price what youre getting will definitely having next time while chicken salad must have list guess will have finally those pizzas,cs1qJvnWUg_f8g020z_3PQ,cs1qJvnWUg_f8g020z_3PQ,5,41558.80305555555,NHaVKUN8gYlscqFmJA2k3A,1,0.09473169864960912,0.5853411513859275,-0.003205128205128205,0.035256410256410256
2854,0,0,OD7SL_HSbo38GyskeJV80A,weather beautiful outside great service pizza very flavorful restaurants uses quality ingredients from organic flour simple tasteful tomatoes sauce olive pizzas simple packed with flavor will definitely back,5ykOWYZ44sUvu9qxD8rPeg,5ykOWYZ44sUvu9qxD8rPeg,4,42792.99791666667,FsGjL_GNpzhvSCQ3DJiHpA,0,0.2642857142857143,0.40204081632653066,0.0,0.02884615384615384
2896,5,5,8smDWFyCcTrBnF6yCwK_IA,have purposely held writing review this spot thinking that perhaps four visits were anomalies norm after last experience saturday have decided that fact that just isnt going better here rosa sonny sublime fact there handful things menu that believe dont better there enough things menu that done equally well better elsewhere that they lose their first star down ambiance actually nice fact quaint with home like feel rooms resulting from what used restaurants concept that they thankfully abandoned this location more roomy than their other venues which really appreciated unless those people that doesnt mind squeezing around door straddling seat into your allotted sqft nice doesnt warrant bump holding stars service what kills this location know believe local food gods refer first point very good some areas lacking others want rate five stars then going have kill service well sort just that good once again meal took sort combative feel quote patton oswalts stand that came later evening pissed right cant wait this plays customer shouldnt feel beholding table saturday when walk have total tables have party five smallest four restaurant should waiter come table three times blurt some information dash other table without much asking drink orders when party asked could move larger tables that might actually accommodate food five people required hold adhoc summit meeting corner comprised five wait staff hostess glaring table whispering hint dont want people know what saying just move your bodies into other room down stars invoking spirit cold peace talk should hostess come speak length table condescendingly explain that other tables reserved larger four tops arent available because parties coming assuming didnt think party could under hours after expressing that could probably meet time requirements larger table someone were actually take order were ushered over different table with grand downton ceremony down more star tainting favorite show making this feel like were make wish being granted their final request then apparently been branded trouble table because were under care experienced peripheral glances from entire wait staff least service picked this point were able place order which have included more items knew were under vacate table before stuck with simple straight forward quite frankly think just wanted there that point amazingly only been restaurant fifteen minutes gone through what seemed like full months worth soap opera drama long staring pauses only appropriate soundtrack fill backdrop result stars food came quickly considering number patrons simplicity order four pizzas this didnt seem like herculean effort poked head around corner peek hovered around table approximate four minute intervals plates were whisked away alarming rate left restaurant fifty eight minutes some most uncomfortable dining experience possible fifth visit will last want food other venues city pass this just other local less glorified spots that with pizza where dont have take submissive stance privilege eating hint honored presence your customers exist their whim other around,cs1qJvnWUg_f8g020z_3PQ,cs1qJvnWUg_f8g020z_3PQ,2,42030.88238425926,dLWDy4yzVzMQuhjoEcRO0g,0,0.12531385281385285,0.475472582972583,0.0,0.035256410256410256
2932,0,0,c0ioRPknce7pxPVEjmZzMQ,ordered pizza have delivered when time pizza come took about hour then after boyfriend even tipped noticed they didnt even wing sauce always sauce side never wings just like eating chicken nuggets great then when called manager complain very rude saying what want about continued rude till like give your money back wings then hung called back spoke head manager male didnt apologize acted nothing just like shell refund long story short they never sent money back card when called corporate office left voicemail they never called back never ordering from here again there restaurants again,yvJqxVTO_qwRGLMtUrqzQw,yvJqxVTO_qwRGLMtUrqzQw,1,43322.61105324074,EmgroYd2E8qQU_2ZuP_kGw,0,-0.04153846153846153,0.29846153846153844,0.0,0.0
2941,1,3,1TTKpy4kHvNaJUwgxKqFFg,pizza heaven most absolute favorite place phoenix salad pizza pasta because vegan dont animals love restaurants that only serve actually make plant based options from scratch just like pizza heaven their homemade veggie balls dream mouth watering vegan baked ziti they have vegan cheese make most amazing pizza also love friendly service lorenzo favorite server always greets with smile calls sweetie always nice touch year woman thanks pizza heaven staff giving reliable place always fill hungry vegan tummies,7eQoxWr9RzyCB9IFvqHUPA,7eQoxWr9RzyCB9IFvqHUPA,5,43233.16375,4QVCF4oKq2r20_hzKRzT3A,3,0.37678571428571433,0.6357142857142856,0.003205128205128205,0.00641025641025641
2945,0,0,JocueMtd6AOH09TGVsF8fw,really wanted like this place spite reviews about slow service staff getting overwhelmed unfortunately true server started really strong disappeared long periods time after wings were delivered cold ordered pizza while were still waiting came back table asked were ready check explained that hadnt gotten pizza when arrived lukewarm very took forever receive check seemed servers were clustered around cashier area mass confusion water never refilled refills beer wine overall real disappointment have reason back there tons great restaurants area,7eQoxWr9RzyCB9IFvqHUPA,7eQoxWr9RzyCB9IFvqHUPA,2,43003.147627314815,rdJCblNqygThJO0dxc1bdw,0,0.025641025641025644,0.4256410256410256,0.003205128205128205,0.00641025641025641
2946,0,0,kzk84mDCvjK_5xq0ic1ghQ,fair tried oreganos twice different locations have tried lots pizza arizona from many different restaurants everyone told oreganosand cant figure pizza sooo marginal really pizza lacks flavor super skimpy toppings last final time went down ordered pizza waitedi waited some morewhile waiting watched different groups people down ordered before mehuh just ordered hawain pizza minutes later finally pizza there barely pineapple then later that evening ended getting runs severe cramping will back this place again grimaldis better,dUffgo9Lh_Vk9TLuFR5ywg,dUffgo9Lh_Vk9TLuFR5ywg,1,42381.10606481481,p_rbeztmMkcM2I6R_WZr7Q,0,0.11601307189542481,0.4300653594771241,0.0,0.02564102564102564
2947,0,0,Gvhqy6RI3gwZOB7WFt0Fug,just lunched northern most humble location landing corporate restaurants excited find yelp that humble also located here provided great option bajillions homes homeowners nearby this center city girl backyard they have outside option earning phoenix restaurant least star atmosphere good service really efficient though lacking personality anyone have though shrimp pizza great looking shrimp before biting sure they were going bland have texture quite wrong veggie salad chop style salad quite good salt adds their fresh mozzarella salad husband reminds that adds high blood pressure fortunately blood pressure salt enjoy,0PMKMyfX1j7Nc4esk1RaMg,0PMKMyfX1j7Nc4esk1RaMg,4,40568.93417824074,4UC0KJYlvA6l-cHkvTn67g,0,0.21841666666666665,0.518111111111111,0.003205128205128205,0.003205128205128205
2995,0,3,pWRQGuju3kgo8hSyn9MWaw,really this place small charming place that isnt overdone doesnt take itself seriousdefinitely romantic vibe nice break from town restaurants wine prices super cheap part because they sell wine retail prices theyll usually sample wines before pick your bottle evening food love house salad with gorgonzola dressing gorgonzola dressing bottle could pizza vegetarian cheese pizza both great love cheese definitely cheese cinque formaggi weve been times will back again soon,jG1jcAeDw0pZTHCNC5kw_w,jG1jcAeDw0pZTHCNC5kw_w,4,40529.6537962963,JMGXvgnZuoUfgPa1CJvrFA,0,0.2717948717948718,0.5512820512820512,0.0,0.003205128205128205
3034,0,1,9rwW_HFnlSS3Y_VmTsdVkw,there half star centurion would stars slightly skeptical first when there just chef waitress restaurant considering this saturday night thought didnt memo that this lunch oriented place place dinner glad wrong once only once they warmly greeted entered were hungry that started with their cheese plate nice assortment manchego double creamed brie since mentioned loved blue chef gave their blue that even menu choose cheeses choices cheese plate nicely arranged with fruits grapes strawberries nuts addition added dijon mustard that gave nice kick compared other restaurants valley nicer cheese plates selections next different kinds risotto coconut shrimp chorizo manchego white truffle which were very rich food just kept coming with filet mignon lamb halibut entree know food just filet mignon good although ordered rare more medium rare side sauce that made lamb fantastic however better lamb nice ambiance however benches were very high move another table thankfully chef aware issue they anticipating taking care patio really cute inviting will perfect place grab drink once they liquor license after weather becomes cool chef very personable will back recommendation espana pizza hope others will this place keep going because wonderful independent restaurant that phoenix needs,pKiSzUlBBRNEdTML24piXA,pKiSzUlBBRNEdTML24piXA,4,40387.067025462966,A0DoQYVztRnqJBmUXMWq9w,1,0.2815380952380952,0.5936285714285714,0.003205128205128205,-0.003205128205128205
3058,0,0,dR8HsqKIbO1fMndwCNcoqw,started suicide plate still here think just have accept that either burned palette general public cant tell really spicy from hole ground macho thing peppers anti drug heart racing cold sweats paranoia that youre never coming down while this isnt bava choco panda still good shit taste tour instructions filling menu very nice introduction what reviewer called food court fight have agree came from scotland afternoon chinese restaurants opened chinese food evening item first time mall just have just wasnt done very british neither mixing with order from italian could have invented mamma bandidos years backd keeping that history mind ready love this place after reading reviews after pollo diablo jerk rice jerk chicken black bean plate will marry this store prop doesnt mess that still cheat with pizza metro think italian part will understand pollo diablo crispy better than buffet attempt most chinese eateries tough middle full garlic damn good good that glad recipe that food network site plan make this soon rice beans their again better than expected they doing better rice than most mexican better stir than most chinese better jerks than team jamaican weightlifters short dont care about canteen feeling cutlery dishes hand take leftovers should ever leave these parts really adds greater whole wall smile believe seen from space,cHdJXLlKNWixBXpDwEGb_A,cHdJXLlKNWixBXpDwEGb_A,5,39717.088483796295,c0cwsmq9LGkKW8RrlTVJjQ,0,0.1843783068783069,0.40310846560846564,0.0,0.0
3070,0,1,vyIfcmt4wUqHIyHA2eE3Pg,this favorite restaurants always crave pizza boom cheesy bread pizza cookie mouth watering just thinking about parking usually frustrating wait long because they dont take reservations food service worth,dUffgo9Lh_Vk9TLuFR5ywg,dUffgo9Lh_Vk9TLuFR5ywg,5,41512.17953703704,O2j1GHm0khKUoHC84COLfQ,1,-0.030000000000000006,0.6799999999999999,0.0,0.02564102564102564
3107,0,0,3JWOpjz-5uNzvCxbx62Qkw,stopped into this restaurant after work because were looking dinner most other restaurants area were packed imagine dragons concert happening nearby little suspicious since other restaurants were crammed there barely anyone here getting hangry decided stop there live music outside which wasnt terrible menu confusing could burger pizza which expected grill they also surprising items like chicken biryani that sprinkled menu craving pizza thats what ordered while coworkers ordered burgers also appetizer sampler which pretty good hard mess fried food when pizza came after look longer hungry about slices done tasted maybe like lunchables pizza that microwaved coworker that ordered cheeseburger didnt finish commented that times didnt finish burger pretty only come here youre starving,vyDW7_CHhDUJshMqaSjj0g,vyDW7_CHhDUJshMqaSjj0g,2,43016.59042824074,JUQIaK-TgSnv8oPY7HgSjA,0,-0.017655723905723914,0.5537037037037037,-0.003205128205128205,-0.003205128205128205
3131,0,0,XFDX75cnCvjmL0nFRiVcBg,marcellas very atypical ambiance scottsdale restaurant which makes experiential treat visit interior school look which reminds italian restaurants east coast midwest parlor outdoor area most interesting places place admire school cabinetry flooring interesting place marcellas relatively food experiences each time been there noticed that menu changed when visited yesterday apparently become more fine dining establishment rather than venture into having pasta dishes vegetarian pizza which surprisingly best thing eaten there flatbread pizza topped with plenty mushrooms tomatoes other veggies garnished with arugula salad that tossed tart dressing although dont envision myself become regular there probably stick veggie pizza avoid further disappointment,5SEwzlWlrxSVyZx3IgXwLg,5SEwzlWlrxSVyZx3IgXwLg,3,40607.81533564815,m4al3aHnNsbAubX4ihfKiA,0,0.1958333333333333,0.34013736263736266,0.0,0.0
