,funny,useful,review_id,text,business_id,ID_bus,stars,date,user_id,cool,polarity,subjectivity,sandwiches_sentiscore,sandwiches_total_business_score
60,0,2,NAYPCgJGdgPHDalo8Gm92A,have been wanting food pizza heaven since moved phoenix from east valley first experience good called order lady answered rude food supposed ready about that case guys gave brother piece pizza sample since were waiting long apparently there some confusion about order being pick delivery after called order food magically appeared sitting oven angry when into vegan delight anger subsided best vegan sausage vegan cheese have ever tasted husband fell love vegan menu embarrassed went there week that good picked same pizza nights later then dined waiter phenomenal like lady answers phones vegan starter veggies bread delish think called mediterranean medley next time husband picked vegan sandwiches veggie ball sandwich this world food fantastic they could just give phone answerer attitude adjustment this place would perfect,7eQoxWr9RzyCB9IFvqHUPA,7eQoxWr9RzyCB9IFvqHUPA,5,41875.95177083334,eyY0yiDvFdIhXrfDWv9k4g,1,0.2361111111111111,0.5004629629629629,0.0,0.022222222222222223
78,0,2,t1X4SfLLLXKNgGG43TMbiA,this place reminds italian delis back northeast they sell everything from sandwiches entrees desserts wine packaged pastas sauces tried cold sandwiches calzones pizzasall were terrific also tried pasta dishes although sauce decent pasta wasnt homemade cooked properly left more desired food dessert this place makes sells surprising that they wouldnt have homemade pasta they sell wine glass bottle they have special prices happy hour definitely check this place,r5PLDU-4mSbde5XekTXSCA,r5PLDU-4mSbde5XekTXSCA,4,41862.00439814815,CYtKqfxO78q8MN6HX2JnDg,2,0.1748917748917749,0.5216450216450217,-0.002777777777777778,0.14999999999999997
102,0,0,fRGgLBsifCt7lurb25lngg,favorite italian deli everything here good from salad pizza pasta sandwiches just cant wrong,r5PLDU-4mSbde5XekTXSCA,r5PLDU-4mSbde5XekTXSCA,5,43298.65960648148,ofB7A0bOw6JUU_x4zOc2-A,0,0.175,0.625,-0.002777777777777778,0.14999999999999997
108,0,0,qdxZJhNzRkDQ_3Ykl68nFw,ordered pizza from these guys first time saturday normally their yummy sandwiches good very fresh dough delicious better than oreganos highly recommend this place,r5PLDU-4mSbde5XekTXSCA,r5PLDU-4mSbde5XekTXSCA,5,43270.72478009259,bYKHOHxB3v0sd5HLmej1Cg,0,0.45000000000000007,0.6104761904761905,0.005555555555555556,0.14999999999999997
130,0,0,wiOLsIxvBpzmTMBb2hZ_WA,shea used drive through coffee business coffee still yummy drive remains open through lunch kitchen eating area inside tiny maybe tables menu includes homemade baked goods sandwiches many fresh ciabatta salads single entree each night tiny kitchen have tasted about half menu items including caprese bruchetta different daily flatbread pizzas havent found didnt like unexpected aspect with excellant selection alcohal favorite minted lemon drop martini friend enjoys manhattan crown royal they serve honest pour outside enclosed patio which friendly great place relax listen occasional band read book when easiest order register then they bring your food staff friendly informed have their attention once while worth enjoy,qQCsLGMncJp1xWUGnOKCQA,qQCsLGMncJp1xWUGnOKCQA,4,41423.76824074074,y9yLaWKlT2aXLBs50FGvaw,1,0.2111528822055138,0.46873433583959895,0.002777777777777778,0.002777777777777778
146,0,0,qa0oErXv1N--iKGKSJ-ICw,debating moving fear being miles further away from defalcos best pizza sandwiches everything cheese steak must,r5PLDU-4mSbde5XekTXSCA,r5PLDU-4mSbde5XekTXSCA,5,41862.22436342593,tm6yH-OJA3f0HmVMeJdylw,0,0.5,0.4,0.002777777777777778,0.14999999999999997
156,0,1,eaHrddgpMRSujLD_1gIGvw,this store made sandwiches wrong delivery argued with then took sandwiches back delivering right ones minutes later while chips pickles drank half spilt pepper always argument with them filed complaint spoke nice corporate offered make meals really nice right place order exactly same ordered before always order again argument just sandwiches were free whole meal messed with pepper half eating pickle chips dinner dont have time argue with people over something stupid this place absolutely horrible will order pizza employees never again here highly recommend skip jimmy johns,vhIJ91MDgUuk4Cr9Kpj1Nw,vhIJ91MDgUuk4Cr9Kpj1Nw,1,42294.154328703706,qberKVwbPzSmycQwli0eMQ,0,-0.023641456582633058,0.4923389355742297,0.002777777777777778,0.002777777777777778
192,1,2,NJZ0faYaLzB1z9XyKX7Pig,drove past this place when going meet friend starbucks decided drop dinner afterwords since looked like novelty probably best idea weve while from time walked door until left such lovely experience hostess very friendly accommodating helped friend choose something menu seat yourself sort place with lots stools tables inside shaded patio with misters general aesthetic this place very home artistic without being overpriced perfect place laid back afternoon supper they have lots pizzas sandwiches salads wines they also have lovely dessert case general great selection ordered chicken pesto sandwich friend ordered half sandwich same tortilla soup sandwich delicious slices chicken instead chunks which something always appreciate came with cheese pesto artichoke hearts peppers tomatoes came toasted bread came with little scoop potato salad sandwich tangy savory potato salad very light unique blend flavors friends soup flavor without being overwhelmingly spicy overall dinner delightful were also drawn dessert case planned getting cookie because they looked soft ended with brownie right choice absolutely best brownies have ever sticky fudgy chewy bottom almost cake like texture highly recommend youre nice might convince them warm give drizzle caramel chocolate awesome thanks excellent food experience service very good prices enjoyable,wHq1efQVz17338k_aUOX3w,wHq1efQVz17338k_aUOX3w,5,42545.07508101852,7epEyqj5mzpQTbSflXl2vA,1,0.3574272486772486,0.6043716931216931,0.0,0.03333333333333333
199,0,2,kT3Pvmn2fIjbdSYEJ2a9rA,doesnt more authentic than defalcos come here everything wine homemade pizza ingredients pasta gelato course their sandwiches favorites philly cheesesteak unreal dont know they purista portobello mushroom sandwich,r5PLDU-4mSbde5XekTXSCA,r5PLDU-4mSbde5XekTXSCA,5,41468.01,_V3aJ-jl5glHVtLm_6aM2A,2,0.5,0.625,0.0,0.14999999999999997
227,2,3,V_QSr4xfyYr9IbE_AsA2Eg,havent reviewed maizies this place delish reminds bistro used work college they have great menu with sandwiches pizza appetizerspasta maybe their wine selection fantastic their happy hour nice just glad have solid restaurant neighborhood light rail anyone that normal restaurant hours they open past love brunch here sometime this technically hand information husband swears they have best italian sandwich ever,NPiLy71qqXzb45k9eQOgCQ,NPiLy71qqXzb45k9eQOgCQ,5,39790.207037037035,f2sQTkz9jv4VCynx1366kg,3,0.35000000000000003,0.5607142857142856,0.002777777777777778,0.016666666666666666
233,0,1,Sar0zq421KQiRAy4aJRRdA,love coming here quick lunch tanya favorite server takes such good care customers they have good selection food from pizza sandwiches appetizers wings more,w6frk94BwGwxenre_zeXUg,w6frk94BwGwxenre_zeXUg,4,41908.784097222226,xbKjuVh3LR_O7B92HSczPg,1,0.46190476190476193,0.6142857142857144,0.0,0.0
237,0,2,IZN0NEUV7K-hfPT9Pxpr4w,heard about this place from some friends when showed their place there heaven delivered again last night still damn good chicken alfredo pizza amazing just right amount everything moist chicken alfredo sauce spinach parmesan nothing overwhelming rich queen margherita basil tomatoes buffalo mozzarella could have eaten entire myself prices with what youd expect pizza worth crust isnt greasy perfect they have other things sandwiches salads havent ventured beyond pizza section menu they deliver sadly live blocks south point,7eQoxWr9RzyCB9IFvqHUPA,7eQoxWr9RzyCB9IFvqHUPA,4,39579.63251157408,CYermXzVz9xmpwDM26vS2A,1,0.19785214785214786,0.6424908424908424,0.0,0.022222222222222223
265,18,30,9k71Z-4r78DWqmWULVHBTQ,italian choice husband picked deflacos dinner twice weeks were pleased after first visit that went back much after this place great that they have made order sandwiches pastas pizzas also wide selection groceries first time went friday night packed even though line long time took order also food reasonable decided grilled veggie sandwich penne mostaccioli side salad husband calzone tortellini salad side salad sandwich side salads were both very colorful tasted great think sandwich would have benefited from having herbed mayonnaise inside sandwich instead really flavor veggies honestly should have just asked extra side since always like there generous amount spread sauce still enjoyed hesitant ordering penne side salad because salami pepperoni meats didnt have strong flavor though wasnt even able tell that pasta salad meat until pieces salami pepperoni very good tortellini side salad equally good this well didnt have super strong flavor recommend either pick with tortellini husband enjoyed calzone much that both times were there first time with mushrooms second time with sausage mushrooms calzone really cheesy quite toppings best part though opinion marinara sauce that came with good gotten margarita pizza second time even huge literally able three meals enjoyed flavors that were this wouldnt number place pizza interested trying just cheese pizza with toppings white pizza overall stars flavors ease ordering good service especially considering grocery store them bring fettuccini alfredo lasagna other tables they looked amazing cant wait back their other menu options,r5PLDU-4mSbde5XekTXSCA,r5PLDU-4mSbde5XekTXSCA,5,42798.68035879629,CjhTdmN6qWEKC7Zo6qadow,30,0.30238095238095236,0.4865079365079365,0.0,0.14999999999999997
268,0,0,PP9jpEBSJM1lMpCl1C-oMA,green love thee count ways vegan have plethora choices from have worry about what made with vegan tsoynamis said vegan crab puffs have specials that change time just wish would make about these specials permanent menu items love some them much depresses when they longer available example chicken schwarma wrap would kill that menu favorite thing ever most your staff some coolest people ever always remember nice when staff remember your favorite specials also helps that husband have been here least times last year dont just make choose from measly salads have sandwiches pizza pasta bowls appetizers chicken mexicali burgers greatest things ever relatively close house dont have trek miles there decide want have worry about making before close have store market where feel need pick vegan cheese there tons reasons here whether vegan have this place amazing matter what menu will disappointed,5FIOXmUE3qMviX9GafGH-Q,5FIOXmUE3qMviX9GafGH-Q,5,40624.97804398148,LHdpvgOYNQj4Jo-K51Bf6g,0,0.12685185185185185,0.637962962962963,-0.002777777777777778,-0.002777777777777778
381,0,1,pycd3I8nzPANjiGFB5VhvA,this place unbelievable great lunch spot great deli been going here years mostly because their sandwiches good chicken cutlet cheese steak chicken pesto sandwich awesome they started making pizza which equally good friendly staff seriously dont like this place dont want friends with,r5PLDU-4mSbde5XekTXSCA,r5PLDU-4mSbde5XekTXSCA,5,40723.87699074074,5UOaNS7wd1DJntUI2EGlFw,0,0.281060606060606,0.7515151515151515,0.002777777777777778,0.14999999999999997
389,0,1,cFj_j03iKBWwqH6pPEnl4g,know youre trouble when hungry immediately yelp find where going havent done wrong yelp recommending pita jungle today lunch baba ghanoush pita pizza there plenty left take home pizza gone almost instant lets debate this classic chicago york style this pita with pizza toppings brain surgery ingredients were what made meal fresh spinach previously frozen tomatoes were firm juicy mushrooms were there touch feta just right pizza spices small pita bread small thats cool just because want like doesnt mean shouldall assorted staff approached were friendly service quick will back falafel pesto pizza macro platter couple other sandwiches that looked good,p-8AMN9Q0qwym-3Pdle20Q,p-8AMN9Q0qwym-3Pdle20Q,4,39788.012604166666,rzq5nqG2NG13o3ISxJSrsQ,1,0.028141534391534377,0.42490079365079364,0.002777777777777778,0.008333333333333333
403,0,1,6OvCsdTgIoajeYutg5S3tA,bianco restaurants italian restaurant favorite best three worlds pizza pasta sandwiches with familiar chris bianco style fresh local ingredients food made from beginning house would definitely worst thing about restaurant trying decide what want could always what though with people love share three things went lunch joshs foraging fowls chicken salad with fingerling potato salad house made mozzarella prosciutto parma special which included fresh made orecchiette pasta with sausage this definitely those meals where know what first because werent sure which dish wanted last longest chef john hall also great addition newest bianco restaurant since farm table background right line with restaurants concept hiring definitely smart move their behalf sincerely looking forward next meal favorite phoenix restaurants,cs1qJvnWUg_f8g020z_3PQ,cs1qJvnWUg_f8g020z_3PQ,5,41327.975694444445,I9u3--BSibni1RAqK1MSmw,0,0.2277210884353741,0.5304232804232804,0.0,0.011111111111111112
440,4,6,132BGmD5yiQICPSOACOQNA,desperate need happy hour last week after running through regular choices kristin melissa suggested that maizies first arrive scored limited parking spots front greeted warmly multiple staff members escorted table back love quaint modern space exactly design aesthetic that enjoy their menu large inviting sandwiches burgers pizzas salads perfect casual cuisine happy hour wine select appetizers draft only their standard starters were excluded happy hour special which still leaves with least choices settled spinach salsa pesto bruchetta spinach came piping which foolishly burned tongue forgiven with cold glass riesling also tried their soup which french onion delish left wanting more dont know three glasses wine fact that maizies that good raved home husband promised take there soon,NPiLy71qqXzb45k9eQOgCQ,NPiLy71qqXzb45k9eQOgCQ,4,39791.051712962966,YX98pz7G4n0wqMmyfmxYuQ,5,0.18076923076923074,0.4860171879402649,0.0,0.016666666666666666
479,1,3,dszoPzf6umeHmCCn5JBnKA,barrows good feel best chain pizza joint town lunch specials kick huge slices drink door great salad sandwiches well pizza sauce good work here when teenager know they make dough sauce house everyday hope barros takes over those other horrible pizza places dominos papa johns pizza still have know idea those places open dont know anyone that crap they have crap pizza high prices barros this place rocks like cheese then extra large over pound cheese more sauce person yeah they have wings,yvJqxVTO_qwRGLMtUrqzQw,yvJqxVTO_qwRGLMtUrqzQw,4,40190.04258101852,aRub-nsvr8bxFfpxsybcrQ,2,0.1032857142857143,0.5862380952380951,0.005555555555555556,0.005555555555555556
507,0,0,yFArzPJ_qK_qVGGdTiMeEw,cute little house been converted into cafe little bartender super nice greeted soon walked arrived friday night there acoustic performer that made feel like coffee shop dont fooled that since this place offers variety beers other drinks menu ranges from sandwiches appetizers pizza pizzas nothing great fancy sandwiches werent either what made great bartender super nice suggested drinks food group thing remember cant your debit credit card cash only,wHq1efQVz17338k_aUOX3w,wHq1efQVz17338k_aUOX3w,3,43010.57996527778,Xb-dGi0iPSNz4qtEDLm8Sw,0,0.2972222222222223,0.6840277777777777,0.005555555555555556,0.03333333333333333
518,1,2,pqK6aFMnAJMCIsNz-qK_Aw,east coast transplant have been search authentic italian imported goods from italy score defalcos italian grocery cafe with salads pizza sandwiches cold pasta soups that made order they have delicious pastry cold case with lemon bars cannolis various italian desserts biscottis made fresh daily their mozzarella seating limited best place group meet there more room back patio after travelling throughout italy there certain staple products that love hooray they here whether cheeses meats packaged pasta canned tomatoes almond syrup youre sure come across some great finds small store actually looks like could italy with their available space definitely worth trip imported beer beverages available,r5PLDU-4mSbde5XekTXSCA,r5PLDU-4mSbde5XekTXSCA,5,42344.23465277778,7kMfuFh7h8PYbcHrqSyqZg,1,0.2127329192546584,0.43057280883367843,-0.002777777777777778,0.14999999999999997
526,0,0,mQgLs7_FDU6A6ItQ5sck6w,oreganos have become chain still always feels like local restaurant amazing food huge portions always will have lunch next their pizzas thin crust really tasty dont forget oreganos favorite salad their sandwiches recommendations veggie wedgy italian above else must much dinner that full dessert their pizza cookie missed,dUffgo9Lh_Vk9TLuFR5ywg,dUffgo9Lh_Vk9TLuFR5ywg,5,42657.891388888886,qN-Hw7ocriLHamOyCCrNzg,0,0.16818181818181818,0.4272727272727273,0.005555555555555556,0.03333333333333333
539,0,0,dtQyEV9M8zcpD6gy80pKTw,sandwiches very tasty liked every that tried pizza last time were there likely will ever ordered again maybe pasta dish next time there,r5PLDU-4mSbde5XekTXSCA,r5PLDU-4mSbde5XekTXSCA,4,40369.84278935185,niKu4se6xtf-ctlm0udr1w,0,0.16,0.4333333333333334,0.002777777777777778,0.14999999999999997
559,21,23,B_2ter_86oq-s8xW0ARySA,defalcos rates five stars because every dish menu that have tried tastes fabulous found defalcos first week during initial scouting trip arizona years after first taste their chicken parmigiana sandwich hooked love meatball sandwich well favorite definitely italian sausage served with roasted green peppers onions with marinara sauce roll your choice talk about foodie nirvana italian sausage sandwich does keep coming here because food excellent pricing reasonable time family members ordered half sandwiches same item they gave full sandwich pricing which discount from half sandwich pricing they didnt have that thats just ways that they look their customers this place gets really busy challenge find seating during busy lunch dinner hours they also have thriving deli these days pizza,r5PLDU-4mSbde5XekTXSCA,r5PLDU-4mSbde5XekTXSCA,5,41638.728414351855,yrGIgk5eaWy-eewLNv4KHQ,23,0.13981481481481486,0.42916666666666664,0.0,0.14999999999999997
601,1,2,X4DoPT-8biMiwCVrbUBdKA,could write long review list every detail just give straight simple best wings excellent pasta great pizza amazing garlic bread great sandwiches ridiculous service good what more could really would drive from cali have some this stuff again amazing,dUffgo9Lh_Vk9TLuFR5ywg,dUffgo9Lh_Vk9TLuFR5ywg,5,40973.7578125,tIVXSfOzelq6Tm4rwd2mAw,1,0.4628205128205129,0.6197802197802198,0.002777777777777778,0.03333333333333333
605,0,0,8NOuqyzy3-OivrZRMNHZmA,love this place fresh made order subs sandwiches eggplant parmesan awesome crispy with great marina cheese like heavy overbaked trays eggplant parmesan thats usually soggy have with only that great gravy messy nice deli counter very friendly staff brick oven pizza counter fresh imported cheeses assorted fresh dried pastas nice market,r5PLDU-4mSbde5XekTXSCA,r5PLDU-4mSbde5XekTXSCA,5,42110.29736111111,mTkb1ftNK7GwIl5s0dgMdA,0,0.32249999999999995,0.6666666666666666,0.002777777777777778,0.14999999999999997
610,0,0,CcJ5alw0MtCJi8YXxNvE1g,husband obsessed with this place love pizza their subs good size prices great tried their pastas mind blown personally like sandwiches pizzas dessert their philly cheese steak delicious husband loves their pizza also their cheesecake tiramisu they expensive cant wait have date night again miss tiramisu give this place wont disappointed,r5PLDU-4mSbde5XekTXSCA,r5PLDU-4mSbde5XekTXSCA,5,43206.89680555555,RZvFoL87yHv3fADFTi5Y7g,0,0.15625,0.7125,0.002777777777777778,0.14999999999999997
691,3,5,,green amazing best veggie vegan restaurant have ever been atmosphere food great highly recommend chicken sandwich they have special espresso sauce thyme fries also really really amazing this healthy veggie place they have asian dishes most their dishes comfort food they have vegan pizzas chicken sandwiches meatball sandwiches fries buffalo wings type stuff most vegetarians vegas crave know sick eating pasta veggie burgers time regular type foods again without spending hours cooking them fortunately live about five minutes from here keep going back trying more items,5FIOXmUE3qMviX9GafGH-Q,5FIOXmUE3qMviX9GafGH-Q,5,39685.995787037034,rA97zeqOrUYuEM69n0Xn4w,4,0.19662337662337662,0.5330830280830281,0.0,-0.002777777777777778
707,0,0,yjbItiWyaE3hqOQPoFTmyw,under ownership things have improved greatly awesome customer service wings still great actually have improved slight price increases didnt there regular regular basis would even noticed owner very customer oriented that shows staff said wings excellent subs sandwiches very good have pizza talking folks have they pretty good fish that awesome remember this place national chain your supporting local business money stays local communities stuffing some corporate wigs pockets,88QR1e2mFNd6Gt3BI1PNpw,88QR1e2mFNd6Gt3BI1PNpw,5,43184.8344212963,BgyTfbIkXqzizi4IihzwOA,0,0.37145833333333333,0.4437820512820513,0.005555555555555556,0.011111111111111112
718,1,1,,what about green well pretty awesome place start gone there quite times since going vegetarian first visit shocked foods mimicked actually tasted better green provides sorts different menu items they have rice noodles bowls with mock meats tofu salads burgers sandwiches mini pizzas delicious soynamis which their based cream delicious they have specials well want follow them twitter like them facebook green also gives selection side items including fries tahini coleslawa favorite pasta many come with main item meal they also include appetizers including artichoke gratine which yummy with chips vegan chilli fries crab puffsanother favorite boneless wings with their homemade vegan ranch dressing only unfortunate thing that both times their wings they have been salty kind ruins things there youre going there first time must their sandwiches huge their secret chickn sandwich messy satisfying almost creepy well imitates real chicken sandwich guiltfree deliciously crafted this sandwich will down boyfriend also into argetine which steaky taste mock meat type sandwich that will sure make your mouth water have their noodle bowls with mock beef sweet sour flavor filling their sandwiches maybe because didnt think there enough noodles theyre pretty good place itself pretty hipster artsy feel vibe many times there will artwork sale contests going definately cool environment they have couple couches great place dine bring your friends really waiter waitress type thing grab menu line order what want counter then they bring when ready most time ready rather quickly dont have worry about flagging down waitress waiter need anything green also hosted think annual thankliving last year that went first time that delicious vegan thanksgiving plate that included everything could imagine thanksgiving veganized delicious definitely event dont want miss love this place comfort food best just vegans swear even youre herbivore will love green,5FIOXmUE3qMviX9GafGH-Q,5FIOXmUE3qMviX9GafGH-Q,5,40624.2796875,VMMb0TJtYVRnicZn_u4FDQ,1,0.23616161616161616,0.6166666666666665,0.0,-0.002777777777777778
719,0,2,KNrYQcpaXw4DbIv4B5uDUQ,quaint sufficient cafe located ground floor university phoenix building fair prices decent customer service adequate selections fresh packaged food already prepared ready serve quick bite food replenishment every week rotates between different menus quite common spot culturally rich entree from time time this welcomed break from monotonous menu that have become overly accustomed house specialities that bistro offers personal pizzas burgers sandwiches salads they also offer decent breakfast menu well such burritos combo plates bagels fresh fruit parfaits there ample seating with hallway that contains chairs booths other fairly large dining area with wide tables that provide sufficient environment colleague discussions kudos board games that corner bistro excellent place which only receives star rating solely quality food ingredients when take price factor into consideration bistro away opportune setting well deserved break,jAO8qYbiYZNbmhK8Knr9Mg,jAO8qYbiYZNbmhK8Knr9Mg,4,42965.15403935185,D3GeQgpvMLwZCCHHdvyqaA,3,0.19285714285714284,0.5484335839598998,0.0,0.0
751,0,1,vGpWwxHhepx1ecxMZvDpaA,oreganos much more needs said food always consistent wait good food with fantastically large portion sizes decent prices super great casual date night take whole family first times didnt venture from pizza that have been many times their pasta delicious along with their lasagnas sandwiches cant wrong,dUffgo9Lh_Vk9TLuFR5ywg,dUffgo9Lh_Vk9TLuFR5ywg,4,42373.96534722222,bqZ4gpGRgZHRfaqII1w04g,0,0.30109890109890114,0.6047619047619048,-0.002777777777777778,0.03333333333333333
822,15,23,dmR27zOdemxE0aaJvuo3nw,corleones still best philly cheese steak west schuylkill river came here this evening with oldest enjoy tasty treat tuesday nights bogo sandwiches been while since both were here together father daughter bonding exercise ordered same thing except differently beef chicken cheese fries chaser both were delicious must getting since each took half home much enjoy cheese steaks weve found their pizza outstanding that thin east coast floppy cheese then this your piece heaven noted both nypd rays good nearby this genuine slice enjoy,Hpi9raHlFm6prTSzFHTurg,Hpi9raHlFm6prTSzFHTurg,4,42956.20559027778,A0j21z2Q1HGic7jW6e9h7A,22,0.27948717948717944,0.5743589743589742,0.0,0.002777777777777778
