,funny,useful,review_id,text,business_id,ID_bus,stars,date,user_id,cool,polarity,subjectivity,sandwiches_sentiscore,sandwiches_total_business_score
4354,0,0,uSTf_41zkz8jyNoePkYaPQ,italian spot looks very unassuming from street sits strip mall prices great look authentic italian groceries wait your food favorites lemon bars dessert first theyre large best ever vegetable lasagna banging artichokes assorted veggies salad with chicken goat cheese bomb pizzas great interestingly havent tried their sandwiches cant imagine theyre anything less than great also like their lattes iced salted caramel what cool authentic italian grocery takeout spot like that they have indoor outdoor seating,r5PLDU-4mSbde5XekTXSCA,r5PLDU-4mSbde5XekTXSCA,5,42531.287407407406,YvqFcX5s0cHhqAFrXvNOHw,0,0.3217261904761905,0.4549107142857143,0.0,0.14999999999999997
4362,0,0,8Ipylui5zBqHsWkTt6_GeQ,schlotzkys interesting because everything about talks about sandwiches being sandwich place sandwiches times they certainly unique they have unique spongey kind bread schlotzskys favorite item always been their secret star pizza call personal preference pizza here rosatis probably best ever they have pretty good cookies here schlotzskys definitely more underrated chains location doesnt really help much still definitely worth especially want pizza,IohmLyQ-spRYgGldapMSyg,IohmLyQ-spRYgGldapMSyg,5,42267.26559027778,8CI7vwT1bKBnaYCf_RuVVg,0,0.34,0.6199999999999999,0.0,0.011111111111111112
4389,0,1,8eHK22bKAmbQWMbeUgmDuQ,pizza heaven first caught original location corner highland building fairly cramped didnt have much offer aesthetic however could very nearly with baseball from condo least give shot disappointed pizza wings pasta sandwiches excellent every employee have encountered been very friendly restaurant moved street location that more representative quality food service great place grab quick slice lunch full beer evenings flyer restaurant claims they have live music weekends although havent witnessed this overall great quality variety pepperoni mushroom pepperocini wheat crust,7eQoxWr9RzyCB9IFvqHUPA,7eQoxWr9RzyCB9IFvqHUPA,4,39321.94600694445,8eqOrd_hmgxDvfiSscJi5Q,0,0.31326231060606063,0.5658333333333334,0.002777777777777778,0.022222222222222223
4437,0,1,XwczYyBt8tdwHS4NcUy4VA,food always great here have been many locations here phoenix food consistent every restaurant visited when family visited camelback location nieces birthday received best service waiter kara kind patient very tentative throughout whole experience just wanted make sure gave special kudos because well deserved besides great service food point ordered wings pasta pizza sandwiches appetizers grandmothers first time this restaurant very impressed with food cant wait visit again more great items menu thank team oreganos wonderful experience,dUffgo9Lh_Vk9TLuFR5ywg,dUffgo9Lh_Vk9TLuFR5ywg,5,43168.84898148148,iCQKx9z2lHlDlZe0hOSqFA,0,0.5838095238095238,0.6129100529100528,0.0,0.03333333333333333
4496,0,2,Djwm6c72FadX3suKSU-BpQ,italian from northeast places like defalcos over place back home living outside insane culture shock went through when moved here left void life then husband found defalcos cheesecake lupini beans sandwiches pizza prosciutto when friday night husband dont want defalcos grab some grub snack watch movie home perfect,r5PLDU-4mSbde5XekTXSCA,r5PLDU-4mSbde5XekTXSCA,5,40455.945972222224,uAcWvAT1JaqRlxF3bfIwPA,1,0.0,0.3416666666666666,0.0,0.14999999999999997
4529,2,2,RfgSRuEUh81RlkUO_TAN4A,usual suspects post yelp event were looking cold beer good bite just fill sweets recommendation some fellow yelp geeks recently tried place came convoy tucked away corner they practically share wall with cornish pasty which still have open door greeted with cozy sports atmosphere with least flat screens going with game crowd lively beer cold told game nights busy when were here group bellied service great small time operation they good with making sure your needs menu good variety salads pizza pasta sandwiches wings choice this fateful night arizona steak sandwich they offer full half deciding half when arrived glad this stuffed full perfectly cooked steak steakums here grilled onions peppers cheese there were some jalapenos because this sandwich just spicy enough lure keep enjoying flavors very myself occasionally going come here again,EHgGscaiJBghjZVT9hsBFw,EHgGscaiJBghjZVT9hsBFw,4,40494.68378472222,gH3JDpHQfVcMEGaAaCJPjA,2,0.11350108225108227,0.5240079365079365,0.0,0.005555555555555556
4539,0,0,BpldU26bTyfNrhsskrQo0w,been here times have tried various items menu from their pizzas hummus their sandwiches soups salads definite plus consistency quality flavor their food have anything havent enjoyed here mentioned other reviewers here their portions large side have dietary restrictions theyre very helpful staff most part friendly accommodating atmosphere usually little busy side relaxed work walls rotates tends topic conversation between friend myself thing sure that weather nice suggest sitting outside simply because tables feel little crowded indoors youre looking have private conversation this isnt place,BgthHqiXot2s4Sd_xcI6DQ,BgthHqiXot2s4Sd_xcI6DQ,4,40492.43628472222,9KueDHLzCQWndjnhkVhHHw,1,0.15558035714285715,0.48591269841269835,0.0,0.0
4546,4,3,RMM3NpLzJhBMD4_kA4MP7w,with many choices good breakfast kind hard stand apart bright urban funky cool scramble breath fresh breakfast scene concept great order counter then youre issued number take seat dining space then relax wait food arrive choose outdoors patio that also friendly judging several quotations humor painted along walls restaurant scramble doesnt take itself seriously slogan menu hits close home were local ingredients locally sourced ingredients hits high marks when local businesses need support there many tastily described items menu that being decisive first thing morning difficult case filled with cinnamon rolls help decision making process many cinnamon roll never encountered like scrambles addition lemon juice frosting distinguishes what would have already been deliciously tender gooey roll took everything power order pack when scan menu find most unique item scramble those standouts brizza unlikely combination words breakfast pizza make creative selection smoked gouda cherrywood bacon atop tender thin crust well paired there wasnt bite left plate spicy kick chorizo with peppers jalapeno cream cheese version doesnt wake then sure bold bottomless coffee french french toast takes thick slices french baguette dipped into vanilla custard then cooked griddle slabs baguette were tender certain creaminess that made dunking into maple syrup real winner like savory sweet side their cherrywood smoked bacon french french toast some with your food bacon dunked into maple syrup such childhood pastime scramble also offers lunch after with menu sandwiches wraps soups salads breakfast served this great because could those cinnamon rolls anytime,8Zqh2jwtncA3N4fWEMTvZQ,8Zqh2jwtncA3N4fWEMTvZQ,4,40244.10875,p_azadim_uWFOXAhhKB3ag,5,0.20672902494331064,0.4722297808012095,0.0,0.005555555555555556
4584,3,7,Ke4pzAZytxKI32cAK4fzXg,family been loyal defalcos since phoenix inception back this home away from home stepping defalcos takes back days where spend grandmas kitchen preparing sunday family dinner preparing everything from homemade sauce meatballs chicken parmesan almond biscotti name defalcos offers extensive menu both takeout dine although venture here times week remain loyal selections their menu feeling like sandwich urge order homemade meatball sandwich crispy baguette youre feeling like chicken then must recommend chicken pesto sandwich again crispy baguette toasted sandwich type girl cant speak cold sandwiches assure wont disappointed with selection given that their breads delivered fresh daily meats cheeses sliced order house their toppings fresh boot complete list also recommend trying chicken pesto salad side salads including tuna pasta salad best ever chicken caesar pasta salad pesto pasta salad andthe tomato basil salad course must drizzle little evoo balsamic make truly italian they also offer many pasta dishes pizza calzones soups sides salads desserts nothing will leave disappointed starving more since their portions generous size italian thing only does defalcos italian favorites just right their store also stocked with italian specialty foods purchase hint grocery name many wonderful rare wine selections only found their store sunday dinner belongs defalcos makes feel like back grandmas place heck some vino while await your lunch dinner served dining room outside terrace although this beloved establishment resides scottsdale please remember check your pretentiousness door because this place loved traditions laid back people,r5PLDU-4mSbde5XekTXSCA,r5PLDU-4mSbde5XekTXSCA,5,41218.907800925925,2Gv7k-jvDXnQHRfnOiXovA,3,0.044996782496782496,0.51988416988417,-0.002777777777777778,0.14999999999999997
4646,8,20,4Mdbif6fux33YpVJafW57g,first impression this place rocks space that used house palette space very breezy sort caribbean plantation feel thats easy relax right into mention moment walk through gate youre greeted friendly smiling faces massive outdoor patio complete with tables well appointed outdoor sofas chairs where leisurely cocktail beer while their grand opening isnt truly until tuesday they seem ironing their kinks pretty quickly with only minor hiccups mostly computer errors rather than human menu made mostly burgers salads lahvosh pizzas entrees ordered starters favorite bacon roasted corn lahvosh pizza half well queen creek olive kalamata tomato fresh basil feta lahvosh half know bacon just about anything have taste awesome paired with right flavors good becomes great sweetness roasted corn with savory saltiness bacon sent into piggy heaven good didnt want share alas good like that queen creek olive lahvosh very tasty lahvosh being crispy light sturdy enough hold ample toppings love olives olive paired with cheese feta great idea cheese being strong enough stand kalamata tastes were right meanwhile were sipping nimbus brown which cold rich complex nimbus certainly favorite craft beers bucks nice also full while cocktails around bucks they pours generous didnt have wine service manager eric used sommelier grill back when best steak houses town knows wine look forward next time when enjoy glass ordered fire island which several classic pischke dishes menu that made over from days owner campbell cook pischkes paradise over years before ruined owners fire island pizza with chicken breast onion green chilies cream cheese sauce that absolutely finger licking tasty sure them over easy eggs outrageous ordered roasted green chile cheeseburger which served breads giant english muffin beefy flavor combined with soft texture english muffin excellent taste quality smokiness green chile order house fries comes with burgers sandwiches just they were seasoned well that could have chowed them down plain however bread butter pickle ketchup simply amazing with dice bread butter pickles never knew ketchup could elevated another experience first impressions last nearly forever this great think bright future front them this will great place hang patio after work with friends drinks cool conversation excellent addition neighborhood,RU2VtVZG8to-XVEHD-2qag,RU2VtVZG8to-XVEHD-2qag,4,39943.08763888889,p_azadim_uWFOXAhhKB3ag,15,0.24320504457490763,0.5657588606218742,0.0,0.0
4680,0,2,KWX3lnjQsuzWi7QB4-yuOg,here equation this review stars tsoynamis appropriately named these things seriously pack gale force taste knock your tongue timbers hand mixed flavours choose rocky road choc chips choc syrup walnuts marshmallowpb peanut butter grahams strawberriesalmond smores quixote choco coffee creation build your ownall with base their fantastic soft serve vegan soft serve true these things about ozand little natural disaster glass recommend sharing plan make your meal words tsoynami breakfast stars pizza sandwiches these were just dissapointing texas poboy with portabello their espresso sauce sounded unique delicious really down sauce altogether sweet peppers were sauteed point sadness they just contributed even more sweetness dish really missed mark sauce executive wing poboy however seemed have stolen flavour spice from texas very enjoy heat fine caution more sensitive buds greasy taste pizza misfire heard good things about type vegan cheese they definitely wanted that while were town mistake just have face into melty cheese thing dairy rolling your eyesyes vegan girl horrible texture taste much omni agreed even scraping taste lingered sauce nice mushrooms onions again were oily veggeroni just store bought yuck hoping some home made less processed seitan something crust just thin flat bread which like pizza sauce tastybut thinly spread affected yuck cheese star free fresh fruit substitute seriously many times have give kidney order some fruit veggies subbed side thank green being reasonable math have stars seriously tsoynamis work that tempted advise green just shut down food side roll tsoynamis stop however really liked fries next time phoenix will definitely green again only tsoynamisand maybe fries recommend same,5FIOXmUE3qMviX9GafGH-Q,5FIOXmUE3qMviX9GafGH-Q,4,39784.6294212963,HW7EEah8AYkytq4ANYUCzg,1,0.0989470284237726,0.5425064599483206,0.0,-0.002777777777777778
4681,0,1,7PVdRrzvmjfc1js8g4qPQg,great place with lots options fuss feel from pizza sandwiches salads desserts everything have delicious favorite being spinach chicken salad with goat cheese pine nuts huge salad always fresh great price dessert love almond biscotti while wait your food theres whole italian grocery check stuffed olives fancy olive noodles wine they have everything place check with delicious eats also love that they punch card show appreciation their customers,r5PLDU-4mSbde5XekTXSCA,r5PLDU-4mSbde5XekTXSCA,5,43068.80577546296,_ISc-Eo7CzDQl-e4pbJctQ,0,0.44999999999999996,0.7041666666666667,0.0,0.14999999999999997
4690,0,1,D0YY8JKlgj-mdtaxoed4OQ,dont hype associated with chris digress love sandwiches panne though dinner partner italian what ordered said very good myself think mine must jinxed order wrong thing every time chris restaurant have admit though hand pressed mozzarella tomatoes italian sausage high quality standards maybe just apps here service fine nothing write home about either restaurant small felt squished however have heard they expanding have also heard they adding pizza pannes menu woot woot well guess will keep trying chris determined good pizza from least time done with each other good luck venture like open kitchen changing menu concept four stars return trip guaranteed because better than most called italian places sadly lacking alsoif picky italian makes pasta gravy from scratch friend likes there something there that missing,cs1qJvnWUg_f8g020z_3PQ,cs1qJvnWUg_f8g020z_3PQ,4,41393.08604166667,dEk7mXM4npuDPmxrwPcEgQ,1,0.13219298245614033,0.4339473684210527,0.002777777777777778,0.011111111111111112
4754,0,2,oJYicGLfSxBZEUpaXSZC-Q,went here last night dinner around wasnt crowded were seated promptly there pizza wine special every weds apparently opted order from menu pizza lunch love trying chicken salad sandwiches places should this place different maizies grapes dried apricots mixed wonderful perfectly peppery balance fruit side server recommended hand sweet potato fries which disappoint love fries that medium like theirs fresh potatoes were amazing chipotle aioli quite good wasnt mood drink what sangria which pretty good would definitely order next time want cocktail ordered special which ribs with sides potatoes roasted veggies some sort corn couldnt finish that quite quite steal have leftovers hope back there happy hour which runs from cant remember weekdays every look forward sangrias,NPiLy71qqXzb45k9eQOgCQ,NPiLy71qqXzb45k9eQOgCQ,3,40353.974803240744,cggzCuDDtfvtKFp2fnLzRQ,0,0.25292207792207794,0.564069264069264,0.0,0.016666666666666666
4786,2,3,Zik0n1x5FygqPbYSOzppiw,like casual atmosphere with good food this place arrived right before saturday night know until arrived that they take reservations area like open concept this restaurant huge room that houses watching area there also separate room back which think larger parties area where they have high tables with stools ordered chicken panini sandwich instead fries bowl cheddar broccoli soup delicious excellent flavor good panini loaded with chicken tomato avocado aioli mayonnaise loved dining companion salmon salad with tasty vinegarette dessert tiaramasu which good creamy with lots flavor sweet people next table pizza which they said good this menu also sandwiches traditional italian dishes like chicken veal parmesan chicken marsala spaghetti meatballs clients this restaurant nice younger older very people liked that think will this list restaurants that like with normal food kale menu,VoXUt6TIJWyIf_lihbN5xQ,VoXUt6TIJWyIf_lihbN5xQ,5,41742.24880787037,0TbZjf8nXBMiOgKrjrIJDw,3,0.19687074829931975,0.6187755102040816,0.0,0.0
4789,7,8,6E_d_NtP6kz3QnfRSujv8w,pizza savant severely limited both nature nurture have been pinnacle biancos pizzeriaa couple times factand found unfulfilling have looked into pizza abyss chuck cheese totinos frozentoo close call come away scarred stronger suppose some nurturethe cattle ranch hard place grow pizza until left home collegeshakeys corvallis losing pizza virginity revelation delighti forever alteredforever better there doubt some nature involvedi only think things that cant neither involves pizza sort that brings todayi will least anybodys pizza some better than others very truly when beautiful carin wandered over oreganos other night with anticipation pretty good pizza pleasant atmosphere enjoy were disappointed entirely reasonable minute wait went quickly with free pizza slices nibble frequent refills drinks while comfortably listened music when tableoutside under mistour server friendly attentive knowledgeablebut already knew what wanted pretty good oreganos this time deep dish pepperoni sausage mushroom olive along with gibbilinis spinach saladway much people leftovers great lunches dinner more days weve thin crust chicago style sandwiches saladeven wings occasion pies well designed well prepared customizable tasty sauce isnt sweet cheeses selected pies complement sauce crusts well made have great tooththe right crunchy chewy seen debatesoh read reviewschicago pies rocknew york only real pizzayada yada yada well waiting pizza rock world that first slice shakeys pepperoni those years agoit ever happenthey never forget your first time oreganos always serves good regardless whether mood chicago thin crust deep dish whateveralong with accompaniments alternatives could does oreganos rock worldno only beautiful carin does that these days they bake pretty decent,dUffgo9Lh_Vk9TLuFR5ywg,dUffgo9Lh_Vk9TLuFR5ywg,4,40011.92596064815,SrF972IxsELYQ3eaWB5X4A,6,0.24548726467331117,0.6208194905869324,0.0,0.03333333333333333
4797,0,1,dt4yJKUyjpLX7zQYemwPlw,first exposed humble local festival being held duck decanter parking they were handing free samples bruschetta tasty snuck back secondsand thirds took while eventually made their actual restaurants surprised much like this place their menu basically heaven bruschetta pizza sandwiches caprese alcohol done best part that tasty menu their food actually really good service first visit here adorable flirty server made feel like second time girl super quick helpful wish remembered their names atmosphere little lacking style definitely strikes chain decor isnt enjoy high tables overall really like humble will continue come back mainly their awesome menu delicious food maybe because that cute waiter,0PMKMyfX1j7Nc4esk1RaMg,0PMKMyfX1j7Nc4esk1RaMg,4,41053.223645833335,1BjI1-O1gxSt8TRO0yD8Gg,0,0.25577160493827167,0.4483950617283951,0.002777777777777778,0.008333333333333333
4829,0,0,9Ebi9ZQdvrVLe4SP9o6H2A,absolutely everything here been freaking delicious chicken parmigiana various pizzas sandwiches pasta desserts this place,r5PLDU-4mSbde5XekTXSCA,r5PLDU-4mSbde5XekTXSCA,5,42615.94944444444,4dBH-_kqS8gk8cSlR1Tecw,0,0.15,0.8374999999999999,0.0,0.14999999999999997
4832,1,0,FLoEp6bdXwfKNhEF0PO3nw,admit sucker places that serve local organic food herbn flavors pretty darn good arrived they close little nervous that they were going rush rude they were actually very welcoming didnt feel rushed which nice dont know people complaining about prices portions quality food think prices fair anyway onto food menu quite extensive pizzas sandwiches pastas salad entrees good variety ordered specials menu gluten free chicken tenders fries gluten free breading actually really good little nervous when food first arrived because thought strips looked kinda they werent just that they werent greasy most places came with really yummy spinach artichoke well dipping notch from ranch dressing sure fries were like steak fries thick which arent favorite overall they were good again greasy fries elsewhere decor okay least mostly ikea works local business worth supporting sure would back,PWW_jT4tHP_r1S18ePJyTQ,PWW_jT4tHP_r1S18ePJyTQ,4,41019.891122685185,A2JGzkvNjckSmps_4FbKWw,1,0.22421875,0.528732638888889,0.0,0.0
4839,4,7,Gd31vfhQZ4auK1n2D2KSIw,loved long trail cant think another place that roasts their beef quite difference from subway large sandwich with thick enough bread hold together happen really like muenster cheese inside pretty small very cozy feels like were invited neighbors kitchen would never have noticed this place good friend hadnt shared discovery with thanks jennifer tucked back left frys nook next paulys pizza definitely looking forward going back will probably long trail again good there were several other sandwiches that sounded delicious names especially house salad course,MbdUXJ-I0dKIrqgfqm1SWQ,MbdUXJ-I0dKIrqgfqm1SWQ,4,41156.043854166666,qCzx039NVrJkWnZEqQ1JKA,5,0.13314935064935066,0.44788961038961045,0.002777777777777778,0.005555555555555556
4846,4,10,Z15Gs2lRJQ-RhPjSIUoz2w,frequently visit humble scottsdale hilton village airport both have always been consistent there plenty choose from menu from salads soups sandwiches pizza pasta additional entrees sides extensive wine list full some favorite items that ordered again again butternut squash soup humble pretzel appetizer chopped salad veggie salad pizza kind recent visit this desert ridge location ordered food take worked great five shared pizza large chopped salad spaghetti meatballs order ready when arrived still time returned mils house around corner everyone enjoyed usual note humble going pricier than ordering pizza salad from national chain that being said think well worth extra money quality selection local flavor bonus tips after revisiting humble website things worth noting humble offers humble hearts program where they will work with patrons meet raise goodwill funds your favorite profit school church arts athletic programs love that have look into this kids under free free item from kids menu sunday even more reason keep humble familys rotation,0PMKMyfX1j7Nc4esk1RaMg,0PMKMyfX1j7Nc4esk1RaMg,4,42758.77489583333,dIIKEfOgo0KqUfGQvGikPg,9,0.16773399014778323,0.44868637110016424,0.0,0.008333333333333333
4847,3,6,Lkk52yBGx3-XPak8g1WZBg,came here super awkward date thankfully service swift enough that didnt last long never been even heard this place suggested both here since sandwiches first date totally awkward picked stone vine tuesday night pretty empty full there handful groups scattered throughout restaurant server seemed handling tables wasnt entirely prompt also werent sitting there twiddling thumbs wine offerings pretty good naturally they have more italian selections than other able find that enjoyed seemed like glass white although wasnt finished menu pretty standard american style italian youve your pizzas sandwiches pastas obligatory chicken parm marsala piccata also have fairly large risotto section that didnt really look hoping find piece fish there either wasnt anything listed didnt look good went with chicken picatta right basically drowning butter which kind what picatta anyway half look like music selection strange italian restaurant they played mostly dont they play italian music that cheesy dont know rather listen maroon lady gaga while supposed having nice quiet dinner would come back hate would recommend guess youre area jonesing some pasta isnt option there have,VoXUt6TIJWyIf_lihbN5xQ,VoXUt6TIJWyIf_lihbN5xQ,3,41397.728530092594,FaAb-CoKW4xDvLTSPtEbgw,4,0.07052845528455287,0.4989256678281067,0.0,0.0
