,funny,useful,review_id,text,business_id,ID_bus,stars,date,user_id,cool,polarity,subjectivity,sandwiches_sentiscore,sandwiches_total_business_score
6717,0,0,dr0theEzxrX9cw6QEkyUmA,love everything about this place parking situation luckily amazing menu options help forget about prior fiasco pizzas smoothies sandwiches amazing love cute little shop with best little novelties fallen angel avocado pizzas amazing cant wrong with salads either,7cK9uEV09iPmsTqOqmY3kQ,7cK9uEV09iPmsTqOqmY3kQ,5,43240.866319444445,3kOiqN8FUDz54CsbdfaWRg,1,0.3113636363636364,0.6454545454545455,0.005555555555555556,0.02777777777777778
6803,0,1,CtlxT8Z42g9mhHa_x9RJ3w,their lunch specials great price same with happy hour love pretzels beer cheese decent side salad their hoagie sandwiches awesome extremely lazy unenthusiastic waiter first experience didnt mention happy hour forgot drink order didnt check back until food gone luckily neighboring server much more friendly stopped converse much more helpful even gave boyfriend free lunch special coupons come back will back again pizza,v2tjswIV3e0c8o7_7MwYmg,v2tjswIV3e0c8o7_7MwYmg,3,41787.16568287037,leBwEW1gpQafIhLIU8CGCQ,0,0.3628968253968254,0.5655423280423281,0.0,0.008333333333333333
6828,55,77,tz1Fm2k8x8P-IJhKDTt9Yw,only question grande orange pizzeria iscan please live here seriously this place great there really formal division between pizzeria grocery parts store going talk about both grocery wise place carries broad classic candies wines cookbooks tchotchkes that rotate seasonally picked some great holiday items here years past grocery staples they also have cafe that serves oatmeal eggs friends rave about commuter sandwich salads sandwiches sushi rolls word wise bring some extra napkins because their bakery will make drool order front counter pick seat then keep your ears perked when they call your name friendly staff cool ambience always find myself shazam music here pizza concerned crust insane almost reminds really good sourdough bread toasted crispy thin thick ingredients fresh pizza permutations creative they serve your slab wood nice presentation sadly creature habit once find something thats liking latch order every time return rest life this particular establishment these personal faves would rocket pizza spicy fresno chilies broccolini roasted peppers roasted garlic dried tomatoes classic chocolate pudding just make poor husband drive across town come here always grumbles admits that place pretty delicious only negative definitely negative parking situation grande orange tinsiest micro parking known good parking gods smiling down just might find open minute parking spot havent been impressed that they actually enforce time restrictions their website under secret parking link shhhh will find diagram depicting other parking options that slightly farther away yeah come check grande orange some great pizza brunch baked goods groceriesthe list goes favorite places phoenix,7cK9uEV09iPmsTqOqmY3kQ,7cK9uEV09iPmsTqOqmY3kQ,5,41769.73427083333,hE9FCBh0BPd2hEhTMNFp3A,75,0.14626924001924,0.6036044973544973,0.0,0.02777777777777778
6855,0,1,bH66fj69BVguOcgMJ9k-ZQ,this place fantastic they have huge menu literally they have numerous pastas pizzas salads sandwiches everything here large cheap which common scottsdale promise there things that remind much love this place first always order their picasso salad salad person this thing made they skimpy with ingredients loads chicken cheese onions with amazing tangy chipotle ranch dressing this thing enough people also traditionally thin crust person they have some best thin crust pizza have ever could entire myself leave here without pazookie dessert fresh baked cookie with scoops cream thats need,_ZwDLtBopUHb6F2mIPFUJg,_ZwDLtBopUHb6F2mIPFUJg,5,40115.31945601852,5DpB9kJXPRl1ytl7r6G5jw,1,0.14776785714285715,0.6460565476190476,0.0,0.002777777777777778
6870,0,0,AlFuTK8ERH7D3l9NNXw9Mw,loved this place open airy space especially with doors open patio this time year server awesome super nice accommodate hubbys multiple requests sample various beers before making final decision also food fantastic tried poutine guac pretzels apps three were poutine definitely star with delicious gravy cheese curds course burgerwish slightly larger patty keep with size definitely tasty would order again hubby pizza which enjoyed others group tacos sandwiches were stuffed happy headed home,hxUxeY8DG9lhyjCVo_s-pw,hxUxeY8DG9lhyjCVo_s-pw,4,42834.64239583333,xF-UIKTBZepSN8pINzLzag,0,0.3137254901960784,0.7098039215686275,0.002777777777777778,0.022222222222222223
6906,0,0,KBs_i59L5w78bctPZE_ecg,interesting place that probably dont enough this entry level pizza actually wide range ingrediants types pizzas giant quite high pizza such oreganos other shelf pizza what solid neighborhood pizza place easy take simple parking inside seating with tables front maybe lunch crowd hungry dont want travel this place decent think they deliver have heard rumors that sandwiches awesome have tried them,Sh-XzCG2pZ59g85kjROciw,Sh-XzCG2pZ59g85kjROciw,3,42215.767280092594,SsCMlswdQiIeb6ZVk4I7Ag,0,0.16958333333333334,0.5643452380952381,0.0,0.002777777777777778
6928,0,0,x-lU0ocShTu7_XzyYHefIQ,tell what time favorite heres food always delicious here other reasons perfect place catch with friends make office away from your office just alone with overly pricey french decor magazine drink lemonade among favorites both tuna sandwiches french pancakes tuna oise salad cottage cheese fresh juices roasted corn pizza sometimes their music taste good youll discover song want your playlist also perfect place pick luxe candle adorable vase suddenly cant live without,7cK9uEV09iPmsTqOqmY3kQ,7cK9uEV09iPmsTqOqmY3kQ,5,42098.64283564815,Mot507cO0uY-KKBvZf7Y-g,0,0.4176136363636364,0.6229166666666667,0.0,0.02777777777777778
6960,0,1,45viInJlDl-Zz2NfIi2RCA,normally airport food good dont together grande orange phoenix harbor your best airport dining they stress quality their food using more natural ingredients providing healthier options they make their pizzas from scratch which made order their wood fired oven unless want pick already made heated they also have array made salads sandwiches well menu where order something freshly made lots variety vegetarian vegan friendly breakfast served until service fast there seating area front hard find table quite pricey what expect from being trapped airport least spend good quality food,DkIEhR8behaIoSexekWV0Q,DkIEhR8behaIoSexekWV0Q,5,42545.97775462963,lH9a97-ZYPUi7J3tqEceaw,0,0.26944444444444443,0.46597222222222223,0.002777777777777778,0.03888888888888889
6973,1,1,u0IvGFYiXkPhhiAnu1_qvw,finally sandwichy type place lunch that more that just sandwiches salads friend fellow partner shopping crime wait that makes sound like shopliffters ended here after disastrous odoriferous trip hidden closet next door both like most everything always split chose crab cilantro with plantain chips corn tomato bacon goat cheese flat bread pizza came immediately first were little disappointed because cold felt would have been better warm after eating while decided that refreshing have cold serving size very generous approval toddler liked plantain chips thought they were bananas partook dipping with pizza size large dinner plate covered goodness corn still crisp cherry tomatoes just popped bacon smokey crowned with mound arugula parmesan that complemented beautifully lived closer came here often would definitely this pizza again left satiated next stop what lucky find stumble across,0gXYLVPNWz0WT8wXQVpS0g,0gXYLVPNWz0WT8wXQVpS0g,4,39968.94480324074,lKPUyA6DveoWk-3zFrHA9w,0,0.10070970695970696,0.5277014652014652,0.0,0.0
6975,0,0,LkTtTord_-mXuQWhFDtcLQ,dont know mushroom isnt rated stars everyone first they possibly have best happy hour deal with price craft beers priced mixed drinks including shelf booze there draft beer selection constantly rotating would they have beers time staff knows there beers appetizers really good price their sandwiches great pizza better than places there they have great beer events every months they have outside patio that nice belly bottom line even with growlers opened near shroom place great beer good food reasonable price,v2tjswIV3e0c8o7_7MwYmg,v2tjswIV3e0c8o7_7MwYmg,5,42822.97278935185,ScmaOHZKnj98NEsyVJCyIQ,0,0.45312499999999994,0.5760416666666666,0.008333333333333333,0.008333333333333333
7032,0,0,fypANgtQyo7h8S2U-bpcag,this first time isabellas kitchen definitely last absolutely loved everything about from friendly attentive service beautiful outdoor seating view this restaurant exceeded expectations server knowledgable about menu patient switched some ingredients others picado salad dined with group others ladies also enjoyed their dishes pizza sandwiches pasta weather perfect environment relaxing enjoyable looking personable restaurant with unique flair delicious food have found,dSnQTUJC0tCHadU1AGzvrw,dSnQTUJC0tCHadU1AGzvrw,5,41787.957962962966,8eYdXcTeJkRDCZsydjkQyQ,0,0.5409090909090909,0.7181818181818181,0.002777777777777778,0.002777777777777778
7084,0,4,Wm2wxu2lkCX8zJn2aLP0Rg,were thrilled that opening charr moon valley along with mini aiellos awesome pizza place were disappointed from hostess bartender waitress himself coming chat with feel like regular restaurant that youve been going years were seated ordered drinks some alcoholic some were good dirty grey goose martini especially good nice find place that will make dirty when asked instead skimping olive juice always plus strong free connection just your server password appetizers table tomato bisque soup onion rings fresno pepper poppers soup very creamy thick goat cheese great added flavor poppers brought some extreme heat table these arent your wimpy sonic jalapeno poppers onion cream cheese filling heat with nice tang warned these things pack punch onion rings wont call them miss they were just after other great offerings various burgers were ordered along with some sandwiches everyone loved obviously fresh made garlic knot buns fresh toppings sauteed crimini mushrooms carmelized onions steak blue sandwich were awesome blue cheese extra little skimpy sandwich taste were offered desserts made including bread pudding apple crumble were full those definitely next time,1WBkAuQg81kokZIPMpn9Zg,1WBkAuQg81kokZIPMpn9Zg,5,41090.215092592596,b_eoPMd72MLjrOTB9IkrYw,1,0.21922043010752684,0.5858147229114972,0.002777777777777778,0.002777777777777778
7102,0,0,I-nhBmuih3UPWBmqMvK1Gg,ordered pizza sandwiches menu pick charts good next time scottsdale area will hitting this place again,6zincCvQTb9BsuK-GHZ4cw,6zincCvQTb9BsuK-GHZ4cw,5,41821.38722222222,cQEInuVaqZP-gtanQGsVSw,0,0.35,0.30000000000000004,0.0,0.005555555555555555
7271,1,7,njJGA2zcUFKOsg2scuuBlA,want supportive kosher establishments town because there arent them there need kosher dining options this coming from someone doesnt keep kosher housed inside jewish community center they maintain their hours operation hours posted irregular best sometimes theyre opensometimes theyre despite what sign says even when theyre open never know what kitchen will serving come more than occasion when theyre open only told that kitchen been shut down early that theyve signature friendly items owners once suggested that call ahead place order ensure that what want ready when arrive tried that only rather rudely told that kitchen closed because they something else going they available were handful cold items when theyre open working with full kitchen food pretty good salads sandwiches pizza pasta personally love tuna challah kids like pizza which brings customer service more often than staff levi catering rude disrespectful downright nasty called order been hung yelled staff member front other customers after questioning inconsistency their hours told that must have friends plans their eating cafe they never smile they never greet people they always though theyre being inconvenienced basic request customer service oxymoron although there small glimmers hope spoken with others eaten there enough know that experience unique although convenient after particularly horrific customer service experience several weeks vowed never back levi catering operates inside independently owned managed truly believe levi catering remains open sheer necessity staff behaves reprehensibly because they long there captive audience hungry members staff guests swim team families levi catering convenience they feel they their cafe business however they want fact manager once told that whatever want because were part complained about last incident with levi catering despite assurances contrary never heard back knowledge action ever taken they were stand alone restaurant they would have gone business long time food isnt just cant support business with such little regard customers customer service,ORWl-Sgc8QvdXqRnWN_8Jg,ORWl-Sgc8QvdXqRnWN_8Jg,1,41407.0174537037,8XWR44OLoNJmlC2gdyj3NQ,0,0.03004227053140097,0.4691425120772947,0.005555555555555556,0.005555555555555556
7274,7,9,6k3jLO8lv-MVDi_1DAKFWQ,grande orange little everything giving quality freshly prepared dishes quickly reasonable prices compact there lots different food stations order breakfast sandwiches cashier pizza another salads sandwiches cookies juices more they have modern menu with healthy choice options like kale quinoa salads veggie burgers chickpea lettuce wraps along with your more normal food items commuter sandwich bacon scrambled eggs tomato mayo avocado english muffin really impressed with freshness breakfast sandwich main item could have bacon turkey smoked salmon avocado went with bacon they only charged extra dollar avocado would totally order this again they have much stuff choose from here that everyone your party should able find something breakfast lunch hurry pick food quickly here down after order fast casual spot guys working airport starbucks suggested this place glad they,DkIEhR8behaIoSexekWV0Q,DkIEhR8behaIoSexekWV0Q,4,42274.71025462963,NOs3g2KLfNvuc9dDWy3syg,9,0.20031565656565656,0.541540404040404,0.0,0.03888888888888889
7344,0,3,WEZB6MbDWC2TKZDL2pnZCg,there definitely buzz here tonight great able experience fate south with family long reviews here highlights amazing beer their beer north always been great fate ality export stout wife gatos golden expanded appetizer menu started with pretzels they always over well with family they have fries tots both were tasty folks next table sweet potato fries that they said were notch expanded dinner menu stuck with favorite pizza town jess nieces pepperoni they pickyall gone addition sandwiches burgers daughter fate burger loved next time visit going give veggie burger also some salmon salad that looked good soif youre looking some place with great food beerid give fate visit staff friendly beer yummy food tasty cant wait cooler nights patio,hxUxeY8DG9lhyjCVo_s-pw,hxUxeY8DG9lhyjCVo_s-pw,5,42239.105532407404,f3VdH-VcRPbU5Uo1OAuLBQ,2,0.425,0.5816666666666667,0.0,0.022222222222222223
7350,0,0,ia89FIwhN5Fa2n2cXEElow,sign their website their newsletter theyll send coupon free dessert ordered pizza from here once giant size course obviously take since theres barely seating half half specialty kinds thought price very reasonable love having pizza leftovers salad once there lunch really good friends raves about their sandwiches havent tried that havent interesting little story wasnt sure which free dessert should asked guys working there they both told they hadnt tried them which seems little weird definitely very helpful ended picking smores cupcake that they only since they said somebody works there somehow related bakery their cookies really good cupcake being delicious mostly chocolate without much marshmallow graham cracker,Sh-XzCG2pZ59g85kjROciw,Sh-XzCG2pZ59g85kjROciw,4,41894.97835648148,9urf9uT1i2N7pM3tkgpI4w,1,0.21371212121212124,0.5864646464646465,0.0,0.002777777777777778
7390,9,15,1n3EFmqSN2tIsGJ8H-jQhQ,have given them three tries even though hated pizza yesterday order only boneless wings salad were edible chicken philly less than tiny cubed chicken hardly cheese burnt bread entire sandwich took scorched flavor scotts meatball parmigiana sando little mozzarella subbed provolone menu stale garlic bread with marinara oddly saut mushrooms hate wasting food mine went into trash scott starving jody owner prompt offer replace sandwiches very nice declined however since weve experiences with inedible food including items before which were will order again person accepts free food invites from management come back will make better instead revisit anonymously have average customer experience being community minded volunteers ourselves commend this location their involvement charitable endeavors consistency pride what kitchen sends good edible product paramount food service industry wish them well hope everyone enjoys their food keeps supporting them done,0rjU_WK5HxoH1fIuEpTpcg,0rjU_WK5HxoH1fIuEpTpcg,2,42906.30118055556,eZfHm0qI8A_HfvXScwIYsg,10,-0.058690476190476175,0.5825396825396826,0.005555555555555556,0.008333333333333333
7444,0,0,gOwQU6UhhX5FhMS2tA9Kag,went there yesterday after being there almost years know were first ones inside main dining area more tables arrived within minute timeframe after that ordered pizza table behind there food appetizer which thru oven other table behind their sandwiches this time seeing pizza food pick area table next their wine watched server look ticket pizza with wine glasses hand proceed deliver open bottle wine which struggling another person another table again walked pizza finally ours sure enough finally girl brought over happy about delivering well told didnt want sitting least minutesshe said under heat lampyou dont leave pizza under lamp that long asked wanted take piece still just okay offered well they made looked like they rushed cheese lightly melted browning looked young manager offered food make another were already there over hour still hadnt eaten said arent waiting another left piece pizza that tasted thin pathetic tasted that burnt flavor which edges this final time going herefunny went some where else people next told about problem they cactus location they arent going back either this establishment really gone downhill very over ratedpizza much better than they believe dont waste your time here,_ZwDLtBopUHb6F2mIPFUJg,_ZwDLtBopUHb6F2mIPFUJg,2,42439.138657407406,YxxKbCqvjed6AhXzbyNDDw,0,0.04434523809523809,0.5028769841269841,0.0,0.002777777777777778
7452,0,0,RXhvlLjJ5RMEx45AlL_HCQ,longtime oreganos customer have enjoyed lunch there often today exception oreganos which opens midday rush menu that includes heckuva slice would interpret midday rush menu quick service today arrived little before both ordered slice pizza didnt served until watched orders were being boxed before orders house customers were served oreganos changes that have been made past year such charges fries with sandwiches loss focaccia bread were disappointing understandable outrageously management today really isnt,_ZwDLtBopUHb6F2mIPFUJg,_ZwDLtBopUHb6F2mIPFUJg,2,43242.833715277775,pCrSYAOZeNVdhJwR3a9MyA,0,-0.12552083333333333,0.5437500000000001,-0.002777777777777778,0.002777777777777778
7459,7,14,9-zTO8XLMLJfHbwbWDfBUQ,secret that love fact that enjoy commuter breakfast sandwich while waiting flight amazing this airport edition lacks charm that actual much more charm than airport restaurant should food tastes exactly same prices same service same they very fast visited breakfast enjoyed commuter sandwich noticed that they have wood fired oven make their well known pizzas they have full menu favorites including their breakfast lunch dinner offerings they also have cookies baked goods made sandwiches located gate worth visiting regardless your location terminal four,DkIEhR8behaIoSexekWV0Q,DkIEhR8behaIoSexekWV0Q,5,41201.17806712963,RBZ_kMjowV0t6_nv2UKaDQ,12,0.23153846153846155,0.4465384615384615,0.002777777777777778,0.03888888888888889
7462,0,0,ZeqBKAsvsowsSwIvNI5-XA,thin crust chicago italian style pizza italian beef sandwiches italian subs antipasto salads good stuff,RztX0zV7ObHZD08SDUhI0Q,RztX0zV7ObHZD08SDUhI0Q,5,42463.97858796296,F4incfAtndpvReXZje--cw,0,0.059999999999999984,0.29000000000000004,0.0,0.0
7501,0,2,AE-1eJa-RH79Awk5I7t2OQ,healthy choices delicious food friendly staff makes pleasant long layover experience very pleased that yelped this place walked concourse from other side airport this place pretty happy with decision lots options choose from here including burgers pizza sandwichesand salads name dessert counter also looked quite tempting either grab meal order down many tables they have here plenty space plop open your laptop grab quick bite plus they carry sriracha rooster sauce here condiment,DkIEhR8behaIoSexekWV0Q,DkIEhR8behaIoSexekWV0Q,4,41700.926203703704,aP1NDRrVlxJOtL7aYJqUzA,3,0.37008547008547005,0.6561965811965812,0.0,0.03888888888888889
7604,0,3,4t9-bZy0uF4HdwHO_G0FNg,isabellas kitchen gets stars atmosphere just love this place based first lunch there building sits right grayhawk golf course with expansive views mountains night they lights city there plenty places hang your even youre dining indoor tables there large outdoor couches rocking chairs fire like seating outdoor tables lights strung from building isabellas surely going very popular hangout well dining spot throughout year server christopher attentive very sincere about making sure that everything liking very knowledgeable place having just opened only days when didnt have answers questions like your patio friendly went manager unfortunately friendly since abuts golf course they many available options their limited opening menu more than than some restaurants have their regular menu regular menu starts tomorrow october worries honestly having seen full menu probably would have picked options anyway cheese dreamy noodles almost consistency gnocchi very tasty with accompanying small cubed creamy cheese crispy bread crumbs this best cheese dishes have long time perfect size share calories could have this main course been full happy hubby meatball sandwich which nice size lunch eggplant parmesan sandwich which came foccacia bread layered eggplant tasty could have been warmer little more sauce cheese both sandwiches came with choice house salad potatoes both opted potatoes they were just amazingly delicious like deep fried potato chip very crispy outside with real potato texture inside delicious will definitely back check some other items that other diners enjoying like bruschetta pizza pasta this place with personality mangia mangia buon appetito,dSnQTUJC0tCHadU1AGzvrw,dSnQTUJC0tCHadU1AGzvrw,4,41197.12125,qxmdrMmjTzgQhyHXKuyy3Q,1,0.33542233560090695,0.5322722251293681,0.0,0.002777777777777778
7634,0,0,sg5Av_KNxFDPAuYmbjNsVw,many vegetarian options love they have several vegetarian pizzas with delicious toppings like tofu tempeh avocado many appetizers sandwiches that friendly easily made that apparently they also have vegan pizzas which didnt inquire about since love cheese ordered mega veggie very delicious most certainly satisfied pizza craving tofu wasnt cooked very wellbut like fact that that ambiance atmosphere existent restaurant cheap elegant layout like cheesecake factory picazzos there urban skater artwork covering walls menu hippie vibe what sure what they going isnt working this place pretty pricey pizza joint ordered beer medium pizza root beer total that price could have some nice cocktails with pizza parlor,HjXI6lKGPVNQ8dYJPtaOCg,HjXI6lKGPVNQ8dYJPtaOCg,3,40703.76357638889,U8m0BamO3PIF29QoLjGFhw,1,0.41541666666666666,0.6511111111111111,0.002777777777777778,0.008333333333333333
7636,0,0,JT8EwAEY4G-0HXdZtZbL9g,this place miss terribly ever since moved away least three times during week long vacays back scottsdale always order exact same thing pablo picasso salad hold cilantro pizzookie chocolate chip course tried pizza sandwiches apps these only things that have coming back dressing picasso salad tastes like delicious mexican party your mouth salad itself many wonderful ingredients including very delicious slightly spicy fajita chicken there four different kinds cheeses here tomatoes chips love this salad however love pretty much nothing more this universe sorry than amazingness that pizzookie often dream about wish could replicate kitchen even other restaurants fail making this dish perfect looking boulders oreganos excels makes want this every never finish whole when feel sick most satisfying usually share pretty greedy territorial though watch service here always very friendly nice many male servers very attractive thats nice bonus prices definitely cheaper side they have some options making your salad junior size bucks less still food bottom line have pizzookie hate later weight made gain from becoming addicted during those orgasmic moments when warm melty cookie your mouth youll thanking,_ZwDLtBopUHb6F2mIPFUJg,_ZwDLtBopUHb6F2mIPFUJg,5,40518.845405092594,yEVQsp9N1nFxFpfXsdPwYA,0,0.154883658008658,0.5850108225108226,0.0,0.002777777777777778
